local-authority-code,council,scope,target,wording,source_url,source_name,data_checked,notes,gss_code,region,local-authority-type-name,county-la,combined-authority
POW,Powys County Council,Council operations,2030.0,"Powys County Council declared a climate emergency on 24th September 2020.  This included an ambition to reduce its carbon emissions to net zero, in line with the Welsh public sector target of 2030.",https://en.powys.gov.uk/climatechange,Climate Change | Powys County Council,,,W06000023,Wales,Welsh unitary authority,,
PRE,Preston City Council,Council operations,2030.0,Make the Council’s activities net-zero carbon by 2030.,https://preston.moderngov.co.uk/mgAi.aspx?ID=36724,Climate Change Emergency | Preston City Council,,,E07000123,North West,Non-metropolitan district,LAN,
PRE,Preston City Council,Whole area,2030.0,Support and work with all other relevant agencies towards making the Preston district Zero Carbon within the same timescale (2030).,https://preston.moderngov.co.uk/mgAi.aspx?ID=36725,Climate Change Emergency | Preston City Council,,,E07000123,North West,Non-metropolitan district,LAN,
RDG,Reading Borough Council,Whole area,2030.0,This Council commits to playing as full a role as possible – leading by example as well as by exhortation – in achieving a carbon neutral Reading by 2030.,https://democracy.reading.gov.uk/documents/s14713/updated%20Appendix%201%20READING%20CLIMATE%20EMERGENCY%20STRATEGY%202020-25-Final.pdf,"The Reading Climate
Emergency Strategy
2020-25",,,E06000038,South East,Unitary authority,,
RCC,Redcar and Cleveland Council,Whole area,2030.0,A motion passed by councillors in March declared a climate emergency and committed to attempting to make the Borough carbon neutral by 2030.,https://www.redcar-cleveland.gov.uk/News/Pages/Council-determined-to-lead-by-example-on-climate-change.aspx,Climate Action | Redcar and Cleveland Council,,,E06000003,North East,Unitary authority,,TVCA
RED,Redditch Borough Council,Whole area,2050.0,"Our commitment to reducing our carbon emissions and influencing the reduction of local carbon emissions goes hand in hand with the 'net zero by 2050' target set by the UK Government, a goal that requires us and all sectors to pull together to achieve.",https://www.redditchbc.gov.uk/council/policy-and-strategy/climate-emergency.aspx,Climate Emergency | Redditch Borough Council,,,E07000236,West Midlands,Non-metropolitan district,WOR,
REI,Reigate & Banstead Borough Council,Council operations,2030.0,RBBC is responding to this challenge by aiming to achieve carbon neutrality (based on scope 1 & 2 emissions - Figure 2) by 2030 with a focus to achieving carbon neutral including scope 3 as soon as possible thereafter.,https://www.reigate-banstead.gov.uk/download/downloads/id/6410/environmental_sustainability_strategy_2020.pdf,Environmental Sustainability Strategy | Reigate & Banstead Borough Council,,,E07000211,South East,Non-metropolitan district,SRY,
REI,Reigate & Banstead Borough Council,Whole area,2050.0,"When considering the borough’s target to achieve net zero carbon by 2050, it is clear that planning guidance and policy play a crucial role in this aim when granting planning permission.",https://www.reigate-banstead.gov.uk/news/article/328/building_a_more_sustainable_future_-_climate_change_and_sustainable_construction_supplementary_planning_document_spd_adopted,Building a more sustainable future | Reigate & Banstead Borough Council,,,E07000211,South East,Non-metropolitan district,SRY,
RFW,Renfrewshire Council,Whole area,2030.0,"In June 2019, there was cross-party support for a council motion which declared a climate emergency in Renfrewshire and a working group was set up with members of all political parties to make recommendations on how to make Renfrewshire carbon neutral by 2030.",https://www.renfrewshire.gov.uk/article/11733/Climate-Change-projects-to-make-Renfrewshire-net-zero,Climate Change projects to make Renfrewshire net zero,,,S12000038,Scotland,Scottish unitary authority,,
RCT,Rhondda Cynon Taf County Borough Council,Council operations,2050.0,Tackling climate change remains a priority of Rhondda Cynon Taf Council as it continues its commitment to become a ‘Carbon-Free Council’ by 2050. ,https://www.rctcbc.gov.uk/EN/Newsroom/PressReleases/2019/July/CouncilRespondsToClimateChange–NetZero.aspx,Climate Change Response | Rhondda Cynon Taf County Borough Council,,,W06000016,Wales,Welsh unitary authority,,
RIB,Ribble Valley Borough Council,Whole area,2030.0,Ribble Valley Borough Council has shown its commitment to tackle climate change by agreeing a corporate objective of ‘to aspire to be a carbon neutral borough by 2030’,https://www.ribblevalley.gov.uk/download/downloads/id/13482/climate_change_strategy_2021-2030.pdf,Ribble Valley Borough Council Climate Change Strategy,,,E07000124,North West,Non-metropolitan district,LAN,
RIH,Richmondshire District Council,Council operations,2030.0,"Making the council’s own activities net-zero carbon by 2030, both production and consumption.",https://www.richmondshire.gov.uk/planning-and-climate-change/climate-change/environment-and-climate-emergency-declaration/,Our climate emergency declaration | Richmondshire District Council,,,E07000166,,,,
RIH,Richmondshire District Council,Whole area,2030.0,Supporting and working with all other relevant agencies to ensure that the whole of Richmondshire achieves net-zero carbon (production and consumption) within the same timescale (2030).,https://www.richmondshire.gov.uk/planning-and-climate-change/climate-change/environment-and-climate-emergency-declaration/,Our climate emergency declaration | Richmondshire District Council,,,E07000166,,,,
RCH,Rochdale Metropolitan Borough Council,Whole area,2038.0,Our ambitious climate change target is for the council and the borough of Rochdale to work towards being carbon neutral by 2038.,http://www.rochdale.gov.uk/pests-pollution-and-food/climate-change/Pages/tackling-climate-change.aspx,Tackling climate change in the borough of Rochdale,,,E08000005,North West,Metropolitan district,,GMCA
ROC,Rochford District Council,Council operations,2030.0,"In July 2020, Rochford District Council made a commitment to work towards becoming carbon neutral by 2030 for its own operations. ",https://www.rochford.gov.uk/environment/carbon-neutral-2030-council-strategy,Carbon Neutral 2030 - Council Strategy | Rochford District Council,,,E07000075,East of England,Non-metropolitan district,ESS,
ROS,Rossendale Borough Council,Council operations,2030.0,Working towards making the council’s activities net-zero carbon by 2030.,https://www.rossendale.gov.uk/download/meetings/id/10394/c1_climate_change_strategy_and_action_plan,Climate Change Strategy and Action Plan,,,E07000125,North West,Non-metropolitan district,LAN,
ROH,Rother District Council,Unclear,2030.0,"In September 2019, Rother District Council declared a climate emergency and pledged to become carbon neutral by 2030.",https://www.rother.gov.uk/consultations/draft-environment-strategy/,Environment Strategy | Rother District Council,,,E07000064,South East,Non-metropolitan district,ESX,
ROT,Rotherham Metropolitan Borough Council,Council operations,2030.0,The Council’s carbon emissions to be at net zero by 2030 (NZ30).,https://www.rotherham.gov.uk/homepage/261/tackling-climate-change,Tackling Climate Change | Rotherham Metropolitan Borough Council,,,E08000018,Yorkshire and The Humber,Metropolitan district,,SCR
ROT,Rotherham Metropolitan Borough Council,Whole area,2040.0,Rotherham-wide carbon emissions to be at net zero by 2040 (NZ40).,https://www.rotherham.gov.uk/homepage/261/tackling-climate-change,Tackling Climate Change | Rotherham Metropolitan Borough Council,,,E08000018,Yorkshire and The Humber,Metropolitan district,,SCR
GRE,Royal Borough of Greenwich,Whole area,2030.0,In June 2019 the Council agreed to set an ambitious target to reach net zero carbon emissions 20 years ahead of the national target. This means building on 2016’s Greener Greenwich strategy and creating a new Greenwich carbon neutral plan with a 2030 target.,https://www.royalgreenwich.gov.uk/info/200327/climate_emergency/2169/what_is_the_council_doing,Developing our carbon neutral plan | Royal Borough of Greenwich,,,E09000011,London,London borough,,GLA
KEC,Royal Borough of Kensington and Chelsea,Council operations,2030.0,"To lead by example by becoming net zero carbon by 2030 from its operations and buildings - embedding the reduction of carbon emissions in all relevant Council decision-making and operations, where we have direct influence.",https://www.rbkc.gov.uk/environment/climate-change/greener-borough,Climate Change targets | Royal Borough of Kensington and Chelsea,,,E09000020,London,London borough,,GLA
KEC,Royal Borough of Kensington and Chelsea,Whole area,2040.0,The borough to be carbon neutral by 2040 -  ten years ahead of the Government’s targets.,https://www.rbkc.gov.uk/environment/climate-change/greener-borough,Climate Change targets | Royal Borough of Kensington and Chelsea,,,E09000020,London,London borough,,GLA
KTT,Royal Borough of Kingston upon Thames,Council operations,2038.0,"In June 2019, Kingston Council declared a Climate Emergency and has committed to deliver carbon neutrality in council operations by 2038. ",https://www.kingston.gov.uk/environment/climate-change-emergency-citizens-assembly?documentId=699&categoryId=20016,Climate Emergency | Royal Borough of Kingston upon Thames,,,E09000021,London,London borough,,GLA
WNM,Royal Borough of Windsor and Maidenhead,Whole area,2050.0,"Our vision is to be a Borough where the community collectively works together to achieve a sustainable future, protecting and enhancing our natural environment and achieving net zero carbon emissions by 2050.",https://www.rbwm.gov.uk/home/environment-and-waste/energy-and-sustainability/environment-and-climate-strategy,Environment and climate strategy | Royal Borough of Windsor and Maidenhead,,,E06000040,South East,Unitary authority,,
RUG,Rugby Borough Council,Council operations,2030.0,The council committed to establish a cross party working group to advise the council’s cabinet on the actions and timescales needed to move towards carbon neutrality by 2030.,https://www.rugby.gov.uk/news/article/1511/council_declares_climate_emergency,Council declares climate emergency | Rugby Borough Council,,,E07000220,West Midlands,Non-metropolitan district,WAR,
RUN,Runnymede Borough Council,No promise,,,,,,No notes,E07000212,South East,Non-metropolitan district,SRY,
RUS,Rushcliffe Borough Council,Council operations,2030.0,Approve a target date for the Council’s direct operations to become carbon neutral by 2030.,https://www.climateemergency.uk/blog/rushcliffe-2/,Climate Declaration | Rushcliffe Borough Council,,,E07000176,East Midlands,Non-metropolitan district,NTT,
RUH,Rushmoor Borough Council,Council operations,2030.0,"Pledge to make the Borough of Rushmoor carbon-neutral by 2030, taking into account production and consumption emissions.",https://www.climateemergency.uk/blog/rushmore/,Climate Declaration | Rushmoor Borough Council,,,E07000092,South East,Non-metropolitan district,HAM,
RUT,Rutland County Council,Council operations,2050.0,Make sure the Council’s activities achieve a net-zero carbon footprint before 2050.,https://www.rutland.gov.uk/my-council/news-archive/2019-archive/council-sets-out-targets-to-help-fight-climate-change/,Council Approves Targets to Help Fight Climate Change | Rutland County Council,,,E06000017,East Midlands,Unitary authority,,
RYE,Ryedale District Council,Whole area,2050.0,"In October 2019, Ryedale District Council joined other bodies in declaring a climate change emergency and making a commitment to actions to help achieve net zero emissions across Ryedale by 2050.",https://www.ryedale.gov.uk/information/community/action-on-climate-change/,Action on climate change | Ryedale District Council,,,E07000167,,,,
SLF,Salford City Council,Whole area,2038.0,The plan sets out our long-term environmental vision – to be carbon neutral by 2038.,https://www.salford.gov.uk/your-council/climate-change/salford-s-climate-emergency-declaration/,Salford’s Climate Emergency Declaration,,,E08000006,North West,Metropolitan district,,GMCA
SAW,Sandwell Metropolitan Borough Council,Council operations,2030.0,This strategy sets out the actions we need to take to get us to our target of net  zero carbon emissions for the Council in 2030.,https://www.sandwell.gov.uk/download/downloads/id/31151/climate_change_strategy.pdf,Climate Change Strategy | Sandwell Metropolitan Borough Council,,,E08000028,West Midlands,Metropolitan district,,WMCA
SAW,Sandwell Metropolitan Borough Council,Whole area,2041.0,"For the whole of the Borough in 
2041 (in line with the West Midlands Combined Authority target). 
",https://www.sandwell.gov.uk/download/downloads/id/31151/climate_change_strategy.pdf,Climate Change Strategy | Sandwell Metropolitan Borough Council,,,E08000028,West Midlands,Metropolitan district,,WMCA
SCE,Scarborough Borough Council,Council operations,2030.0,The Council formally declared a climate emergency in January 2019 with a view to be net-zero carbon by 2030.,https://www.scarborough.gov.uk/opendata/foi-disclosure-log/action-plan-council-area-go-net-zero-carbon-and-target-date,Net Zero Carbon | Scarborough Borough Council,,,E07000168,,,,
SCB,Scottish Borders Council,Council operations,2045.0,This route map sets out the scope of our ambition as a Council to reach the Scottish Government target of net zero by 2045 and opportunities for action.,https://www.scotborders.gov.uk/news/article/4094/council_sets_out_plan_to_meet_net_zero_target,Net Zero Target | Scottish Borders Council,,,S12000026,Scotland,Scottish unitary authority,,
SEG,Sedgemoor District Council,Whole area,2030.0,"These documents have been created following the council's declaration of a Climate Emergency and its pledge to work with partners, individuals and community groups to identify ways to make Sedgemoor and Somerset carbon neutral by 2030, taking into account both production and consumption emissions.",https://www.sedgemoor.gov.uk/article/4093/Climate-Change,Sedgemoor Climate Emergency Strategy & Action Plan,,,E07000188,,,,
SFT,Sefton Metropolitan Borough Council,Council operations,2030.0,Make the Council’s activities net-zero carbon by 2030.,https://www.sefton.gov.uk/environmental-protection/energy-and-environment/climate-emergency/,Environmental Protection | Sefton Metropolitan Borough Council,,,E08000014,North West,Metropolitan district,,LCR
SFT,Sefton Metropolitan Borough Council,Whole area,2030.0,Support and work with all other relevant agencies towards making the Sefton area Zero Carbon within the same timescale (2030).,https://modgov.sefton.gov.uk/documents/s96865/Climate%20Emergency-%20Strategy%20final.pdf,Sefton Climate Emergency Strategy,,,E08000014,North West,Metropolitan district,,LCR
SEL,Selby District Council,Council operations,2030.0,As the Leader of the Council I am setting a clear ambition for the Council to achieve net zero greenhouse gas emissions by 2030 (‘Net Zero 2030’).,https://cds.sevenoaks.gov.uk/documents/s39891/,Net Zero 2030 | Selby District Council,,,E07000169,,,,
SEV,Sevenoaks District Council,Council operations,2030.0,We have committed to achieving net zero carbon by 2030. This means that we have pledged to reach net zero carbon emissions produced by the Council and our assets by 2030.,"https://www.sevenoaks.gov.uk/info/20002/your_environment_and_community/495/climate_change_-_net_zero_carbon_council#:~:text=We%20have%20committed%20to%20achieving,and%20our%20assets%20by%202030.",Climate change - Net zero carbon Council | Sevenoaks District Council,,,E07000111,South East,Non-metropolitan district,KEN,
SHF,Sheffield City Council,Whole area,2050.0,Setting the goal of becoming a zero carbon city by 2050.,https://democracy.sheffield.gov.uk/mgAi.aspx?ID=18587,Declaring a Climate Emergency | Sheffield City Council,,,E08000019,Yorkshire and The Humber,Metropolitan district,,SCR
SCR,Sheffield City Region Combined Authority,Whole area,2040.0,"Therefore, immediate action is required to reach zero or near zero carbon by no later than 2040.",https://data.climateemergency.uk/media/data/plans/sheffield-city-region-combined-authority-18e42a5.pdf,Climate Emergency Response Framework | Sheffield City Region Combined Authority,,,E47000002,Yorkshire and The Humber,Combined authority,,
ZET,Shetland Islands Council,No promise,,,,,,"The Strategic Outline Programme (Appenix 1) notes that the Council will have an obligation to set local emission reduction targets, bearing in mind the statutory targets legislated by the Scottish Government are for a 75% reduction in carbon emissions by 2030 and net zero by 2045.",S12000027,Scotland,Scottish unitary authority,,
SHR,Shropshire Council - Unitary,Whole area,2030.0,Our vision is for Shropshire Council to become carbon net-neutral by 2030 and assist in the ambition for Shropshire as a whole to become carbon net-neutral in the same year.,https://shropshire.gov.uk/shropshire-climate-action/what-have-we-achieved/our-commitment/,Climate Commitment | Shropshire Council - Unitary,,,E06000051,West Midlands,Unitary authority,,
SLG,Slough Borough Council,Whole area,2030.0,"Slough Borough Council has set a stretch target of borough-wide carbon neutrality by 2030, with an objective target of 2040.",https://www.slough.gov.uk/strategies-plans-policies/climate-change/2,"Slough’s draft Climate Change Strategy and Action Plan

 ",,,E06000039,South East,Unitary authority,,
SOL,Solihull Metropolitan Borough Council,Council operations,2030.0,The Council has committed to becoming ‘net zero carbon’ by 2030.,https://www.solihull.gov.uk/sites/default/files/2020-11/Carbon-Report-2019-20.pdf,Carbon Report | Solihull Metropolitan Borough Council,,,E08000029,West Midlands,Metropolitan district,,WMCA
SOM,Somerset County Council,Whole area,2030.0,The Councils have come together to produce the Somerset Climate Emergency Framework which will identify ways to make Somerset carbon neutral by 2030.,https://www.somerset.gov.uk/climate-emergency/your-questions-answered/,Climate Emergency Questions | Somerset County Council,,,E10000027,,,,
SAY,South Ayrshire Council,Council operations,2045.0,The Council have recently agreed to align with these national targets of a 75% reduction in emissions by 2030 and net zero emissions by 2045.,https://ww20.south-ayrshire.gov.uk/ext/committee/CommitteePapers2021/Leadership%20Panel/15%20June%202021%20Education/item%206b%2020210615%20LP%20Net%20Zero%20Retrofit.pdf,Net Zero Carbon Retrofit | South Ayrshire Council,,,S12000028,Scotland,Scottish unitary authority,,
SCA,South Cambridgeshire District Council,Whole area,2050.0,"Our Zero Carbon Strategy [PDF, 5.5MB] was adopted on 21 May 2020. It outlines how we are supporting the district to halve carbon emissions by 2030 and reduce them to zero by 2050, including delivering a reduction in our own carbon footprint of at least 45% by 2025, (on a 2019 baseline), and at least 75% by 2030.",https://www.scambs.gov.uk/nature-and-climate-change/zero-carbon-strategy-and-action-plan/,Zero carbon strategy and action plan | South Cambridgeshire District Council,,,E07000012,East of England,Non-metropolitan district,CAM,CPCA
SDE,South Derbyshire District Council,Council operations,2030.0,In May 2021 the Climate and Environment Action Plan was updated to reflect the Council’s pathway to carbon neutral for the councils activities aim by 2030.,https://www.southderbyshire.gov.uk/our-services/climate/climate-and-environment-emergency/what-the-council-is-doing/climate-environment-action-plan,Climate and Environment Action Plan | South Derbyshire District Council,,,E07000039,East Midlands,Non-metropolitan district,DBY,
SDE,South Derbyshire District Council,Whole area,2050.0,In May 2021 the Climate and Environment Action Plan was updated to reflect the Council’s pathway to carbon neutral for the councils activities aim by 2030 and district aims of carbon neutrality before 2050.,https://www.southderbyshire.gov.uk/our-services/climate/climate-and-environment-emergency/what-the-council-is-doing/climate-environment-action-plan,Climate and Environment Action Plan | South Derbyshire District Council,,,E07000039,East Midlands,Non-metropolitan district,DBY,
SGC,South Gloucestershire Council,Whole area,2030.0,"In July 2019, we declared a Climate Emergency, pledging to lead South Gloucestershire to become carbon neutral by 2030.",https://beta.southglos.gov.uk/climate-emergency-in-south-gloucestershire/,Climate emergency in South Gloucestershire,,,E06000025,South West,Unitary authority,,WECA
SHA,South Hams District Council,Council operations,2030.0,That the Council aim to reduce its organisational carbon emissions to net-zero by 2030.,https://354f7b1d-38b9-4b49-a905-e28603b1db5f.filesusr.com/ugd/faccb1_ed7c3cbc571a4e879957fe960907c0a2.pdf,South Hams District Council Climate Change and Biodiversity Strategy,,,E07000044,South West,Non-metropolitan district,DEV,
SHA,South Hams District Council,Whole area,2050.0,That the Council commit to working with partners through the Devon Climate Emergency Response Group to aim to reduce the District of South Hams’ carbon emissions to net-zero by 2050 at the latest.,https://354f7b1d-38b9-4b49-a905-e28603b1db5f.filesusr.com/ugd/faccb1_ed7c3cbc571a4e879957fe960907c0a2.pdf,South Hams District Council Climate Change and Biodiversity Strategy,,,E07000044,South West,Non-metropolitan district,DEV,
SHO,South Holland District Council,No promise,,,,,,No notes,E07000140,East Midlands,Non-metropolitan district,LIN,
SKE,South Kesteven District Council,Council operations,2050.0,"SKDC, with cross-party support, declared a climate emergency in September 2019 when it pledged to reduce its carbon footprint by at least 30% by 2030 and become net-zero carbon as soon as viable before 2050.","http://www.southkesteven.gov.uk/index.aspx?articleid=15062#:~:text=SKDC%2C%20with%20cross%2Dparty%20support,soon%20as%20viable%20before%202050.&text=%22The%20publication%20of%20our%20carbon,in%20our%20climate%20emergency%20plan.",Carbon Reduction Pledge | South Kesteven District Council,,,E07000141,East Midlands,Non-metropolitan district,LIN,
SLA,South Lakeland District Council,Council operations,2030.0,South Lakeland District Council’s ambition is to be a “carbon-neutral” council by 2030.,https://www.southlakeland.gov.uk/media/7208/climate-change-action-plan-accessible.pdf,Climate Action Plan | South Lakeland District Council,,,E07000031,,,,
SLA,South Lakeland District Council,Whole area,2037.0,SLDC has also signed up to the Cumbria Joint Public Health Strategy: To become a “carbon-neutral” County and to mitigate the likely impact of existing climate change. SLDC have confirmed a target date for South Lakeland of 2037. ,https://www.southlakeland.gov.uk/media/7208/climate-change-action-plan-accessible.pdf,Climate Action Plan | South Lakeland District Council,,,E07000031,,,,
SLK,South Lanarkshire Council,No promise,,,,,,No notes,S12000029,Scotland,Scottish unitary authority,,
SNO,South Norfolk District Council,Council operations,2030.0,"We will put sustainability at the heart of delivery and, as a Council, will achieve a net zero carbon emission position by 2030.",https://www.southnorfolkandbroadland.gov.uk/downloads/file/5795/south-norfolk-council-environmental-strategy-and-delivery-plan,"Environmental Strategy and Delivery
Plan 2023 – 2025",20/11/23,IB found,E07000149,East of England,Non-metropolitan district,NFK,
SNO,South Norfolk District Council,Whole area,2050.0,"We will provide regional and national leadership on the energy transition as we move from fossil fuels to clean sources of power. This will deliver a clean, vibrant, and sustainable economy and contribute towards the Government's net zero 2050 target.
",https://www.southnorfolkandbroadland.gov.uk/downloads/file/5795/south-norfolk-council-environmental-strategy-and-delivery-plan,"Environmental Strategy and Delivery
Plan 2023 – 2025",20/11/23,IB found,E07000149,East of England,Non-metropolitan district,NFK,
SOX,South Oxfordshire District Council,Council operations,2025.0,Our climate action targets are to: become carbon neutral within our own operations by 2025.,https://www.southoxon.gov.uk/south-oxfordshire-district-council/tackling-the-climate-emergency/,Action on climate and nature | South Oxfordshire District Council,,,E07000179,South East,Non-metropolitan district,OXF,
SOX,South Oxfordshire District Council,Whole area,2030.0,Our climate action targets are to: be a carbon neutral district by 2030.,https://www.southoxon.gov.uk/south-oxfordshire-district-council/tackling-the-climate-emergency/,Action on climate and nature | South Oxfordshire District Council,,,E07000179,South East,Non-metropolitan district,OXF,
SRI,South Ribble Borough Council,Whole area,2030.0,"The borough sets a goal of rendering the borough carbon neutral by the year 2030. For avoidance of doubt, this goal means the borough shall produce no net carbon emissions by this date, taking into account of actions that have the effect of removing carbon from the environment.",https://www.southribble.gov.uk/article/1552/Appendix-2,Climate Targets | South Ribble Borough Council,,,E07000126,North West,Non-metropolitan district,LAN,
SSO,South Somerset District Council,Council operations,2023.0,"Our ambition is to be carbon neutral across our own operations and land holdings by 2030 at the latest, and ideally by 2023, so any residual carbon emissions will need to be offset.",https://www.southsomerset.gov.uk/media/2690/environment-strategy-document-3-final.pdf,South Somerset Environment Strategy,,,E07000189,,,,
SST,South Staffordshire Council,No promise,,,,,,No notes,E07000196,West Midlands,Non-metropolitan district,STS,
