local-authority-code,council,scope,target,wording,source_url,source_name,data_checked,notes,gss_code,region,local-authority-type-name,county-la,combined-authority
MAL,Maldon District Council,Whole area,2030.0,To support and work with all other relevant agencies towards making Maldon Doistrict and its parishes net-zero carbon within the same timescale (2030).,https://democracy.maldon.gov.uk/documents/s22491/Appendix%201.pdf,Climate Emergency Statement | Maldon District Council,,,E07000074,East of England,Non-metropolitan district,ESS,
MAV,Malvern Hills District Council,Council operations,2030.0,The aim of which is to achieve net zero emissions ‘as quickly as possible’ - with its own operations becoming carbon neutral by 2030.,https://www.malvernhills.gov.uk/?option=com_fileman&view=file&routed=1&name=Destination%20Zero.pdf&folder=Documents%2FAbout%20Your%20Council&container=fileman-files,Destination Zero | Malvern Hills District Council,,,E07000235,West Midlands,Non-metropolitan district,WOR,
MAV,Malvern Hills District Council,Whole area,2050.0,"The aim of which is to achieve net zero emissions ‘as quickly as possible’ - with its own operations becoming carbon neutral by 2030, and the district as a whole by 2050 at the very latest.",https://www.malvernhills.gov.uk/?option=com_fileman&view=file&routed=1&name=Destination%20Zero.pdf&folder=Documents%2FAbout%20Your%20Council&container=fileman-files,Destination Zero | Malvern Hills District Council,,,E07000235,West Midlands,Non-metropolitan district,WOR,
MAN,Manchester City Council,Whole area,2038.0,We have set ourselves the aim of making Manchester a zero-carbon city by 2038 or before – at least 12 years earlier than the national 2050 target.,https://secure.manchester.gov.uk/info/500002/council_policies_and_strategies/3833/climate_change,Zero Carbon Manchester | Manchester City Council,,,E08000003,North West,Metropolitan district,,GMCA
MAS,Mansfield District Council,Whole area,2040.0,Make Mansfield carbon neutral by 2040,https://www.mansfield.gov.uk/downloads/file/2970/approved-draft-climate-change-strategy-september-2021,Climate Change Strategy and Delivery Plan | Mansfield District Council,,,E07000174,East Midlands,Non-metropolitan district,NTT,
MDW,Medway Council,Council operations,2050.0,"We will set organisational five-year carbon budgets and an emissions reduction pathway to 2050, with significant reduction by 2030.",https://www.medway.gov.uk/download/downloads/id/5872/medway_climate_change_action_plan_-_june_2021.pdf,Medway Climate Change Action Plan - June 2021,,,E06000035,South East,Unitary authority,,
MDW,Medway Council,Whole area,2050.0,"The objective of the KMELES is to outline a joint Kent and Medway approach to achieving a reduction in carbon emissions and improvements in air quality, with an agreed Kent and Medway target of net zero emissions by 2050.",https://democracy.medway.gov.uk/mgConvert2PDF.aspx?ID=58212,Climate Change Action Plan and Medway Net Zero Carbon Baseline Report |Medway Council,,,E06000035,South East,Unitary authority,,
MEL,Melton Borough Council,Council operations,2030.0,"To DECLARE a “Climate Emergency”, with an aim to make Melton Borough Council activities as far as practical carbon neutral by 2030 and further promote a cutting of emissions within the wider Borough of Melton.",https://democracy.melton.gov.uk/mgAi.aspx?ID=3567,Climate Emergency Declaration | Melton Borough Council,,,E07000133,East Midlands,Non-metropolitan district,LEC,
MEN,Mendip District Council,Whole area,2030.0,Establishing a baseline emissions inventory is the first step in determining how to deliver on the Councils Carbon Emissions Pathway to enable the district to be Net-Zero by 2030.,https://www.mendip.gov.uk/article/8650/Climate-Action,Climate Targets | Mendip District Council,,,E07000187,,,,
MTY,Merthyr Tydfil County Borough Council,Council operations,2030.0,We are also working with an Energy Specialist to help prepare a Council plan and road map that will enable us to play our role in the Welsh Public Sector becoming Carbon Neutral by 2030.,https://www.merthyr.gov.uk/council/decarbonisation/decarbonisation/,Decarbonisation | Merthyr Tydfil County Borough Council,,,W06000024,Wales,Welsh unitary authority,,
MDE,Mid Devon District Council,Whole area,2030.0,"Members agreed to the Devon-wide target of becoming carbon neutral by 2050, but will aim for Mid Devon to become carbon neutral by the more ambitious date of 2030.

",https://www.middevon.gov.uk/council-thrilled-to-secure-funding-to-reduce-carbon-emissions/,Carbon Reduction Funding Secured | Mid Devon District Council,,,E07000042,South West,Non-metropolitan district,DEV,
MSU,Mid Suffolk District Council,Whole area,2030.0,"
At full Council meetings on 23rd July 2019 and 25th July 2019 respectively Babergh & Mid Suffolk District Councils recognised the existence of a climate emergency and committed to investigating ways in which they could reduce their own emissions and to supporting the Suffolk-wide aim to become carbon neutral by 2030.",https://baberghmidsuffolk.moderngov.co.uk/documents/s19374/Appendix%20A%20-%20Carbon%20Reduction%20Management%20Plan.pdf,Environmental Response | Mid Suffolk District Council,,,E07000203,East of England,Non-metropolitan district,SFK,
MSS,Mid Sussex District Council,No promise,,,,,,No Notes ,E07000228,South East,Non-metropolitan district,WSX,
MDB,Middlesbrough Borough Council,Council operations,2029.0,We have ambitious targets to be carbon neutral by 2029 as an organisation.,https://www.middlesbrough.gov.uk/sites/default/files/Green-strategy-Jun21.pdf,Green Strategy | Middlesbrough Borough Council,,,E06000002,North East,Unitary authority,,TVCA
MDB,Middlesbrough Borough Council,Whole area,2039.0,"Our goal is for the whole town to be carbon neutral ten years later [2039], well ahead of the government’s 2050 target.",https://www.middlesbrough.gov.uk/sites/default/files/Green-strategy-Jun21.pdf,Green Strategy | Middlesbrough Borough Council,,,E06000002,North East,Unitary authority,,TVCA
MLN,Midlothian Council,Council operations,2030.0,"In December 2019, Midlothian Council passed a motion declaring a ‘climate emergency’. This includes a commitment to make the council’s activities net-zero carbon by 2030.",https://www.midlothian.gov.uk/info/1231/environment/445/sustainable_development_and_climate_change/2,Sustainable development and climate change | Midlothian Council,,,S12000019,Scotland,Scottish unitary authority,,
MIK,Milton Keynes,Whole area,2030.0,Milton Keynes will be the world’s greenest and most sustainable city by becoming carbon neutral by 2030 and carbon negative by 205 of the world’s most truly sustainable economies and models for growth.,https://www.milton-keynes.gov.uk/environmental-health-and-trading-standards/mk-low-carbon-living/the-2019-2050-sustainability-strategy,Sustainability Strategy | Milton Keynes,,,E06000042,South East,Unitary authority,,
MOL,Mole Valley District Council,Council operations,2030.0,Mole Valley District Council (MVDC) declared a climate emergency in June 2019. One key aspect of the climate emergency declaration is the target to make Council’s operations carbon neutral by 2030.,https://www.molevalley.gov.uk/sites/default/files/home/community/climate-change-sustainability/mvdccarbonfootprintreport1819finalaccessible.pdf,Mole Valley District Council Climate Action Planning,,,E07000210,South East,Non-metropolitan district,SRY,
MON,Monmouthshire County Council,Council operations,2030.0,Carbon emissions from fossil fuels are one of the main causes of climate change and as a council we are striving to become carbon neutral by 2030.,https://www.monmouthshire.gov.uk/app/uploads/2019/11/Climate-and-Decarbonisation_Strategy_v1.0.pdf,Monmouthshire County Council Climate Emergency Strategy,,,W06000021,Wales,Welsh unitary authority,,
NTL,Neath Port Talbot County Borough Council,No promise,,,,,,No notes,W06000012,Wales,Welsh unitary authority,,
NEW,New Forest District Council,No promise,,,,,,News articles mention carbon neutral by 2050 but could not fin confirmation of this by the council,E07000091,South East,Non-metropolitan district,HAM,
NEA,Newark and Sherwood District Council,Council operations,2035.0,We want to be carbon neutral by 2035.,https://www.newark-sherwooddc.gov.uk/climatechange/#d.en.127350,Climate change emergency | Newark and Sherwood District Council,,,E07000175,East Midlands,Non-metropolitan district,NTT,
NTCA,"Newcastle Upon Tyne, North Tyneside and Northumberland Combined Authority",No promise,,,,,,No notes ,E47000011,North East,Combined authority,,
NEC,Newcastle-Under-Lyme District Council,Council operations,2030.0,We commit to achieving 100% carbon neutrality across our own operations and assets by 2030 at the latest through a combination of reducing carbon production and offsetting of any residual carbon emissions.,https://moderngov.newcastle-staffs.gov.uk/documents/s34209/Sustainable%20Environment%20Strategy%20v3.pdf,"Newcastle-under-Lyme Sustainable Environment
Strategy",,,E07000195,West Midlands,Non-metropolitan district,STS,
NET,Newcastle-upon-Tyne City Council,Whole area,2030.0,"Despite the devastating impacts of Covid-19, the city’s determination and cross-party commitment to achieving
Net Zero status by 2030 remains undiminished. ",https://www.newcastle.gov.uk/sites/default/files/Climate%20Change/Net%20Zero/Net%20Zero%20Newcastle%20-%202030%20Action%20Plan_0.pdf,Net Zero Newcastle - 2030 Action Plan,,,E08000021,North East,Metropolitan district,,NTCA
NWP,Newport City Council,Council operations,2030.0,"I will continue to work closely with the community, partner organisations, elected members and officers to ensure the council continues to work towards our challenging but exciting and achievable vision of becoming a net carbon neutral organisation by 2030.",https://democracy.newport.gov.uk/documents/s17180/01a%20Carbon%20Mngmnt%20Plan%20Draft%20for%20Review.pdf,Carbon Management Plan | Newport City Council,,,W06000022,Wales,Welsh unitary authority,,
NFK,Norfolk County Council,Whole area,2030.0,"Striving to meet this collective global challenge, we will work with our neighbours within the region, specifically Suffolk County Council and theBroads Authority, to collectively achieve ‘net zero’ carbon emissions onour estates by 2030, but within our wider areas, work towards‘carbon neutrality’ also by 2030.",https://nationalauditoffice.sharepoint.com/eccl612/Downloads/Norfolk%20County%20Council%20Environmental%20Policy%20(1).pdf,Environmental Policy | Norfolk County Council,,,E10000020,East of England,County,,
NAY,North Ayrshire Council,Whole area,2030.0,Agrees the proposed target year of 2030 to achieve net- zero emissions across North Ayrshire,https://north-ayrshire.cmis.uk.com/north-ayrshire/Document.ashx?czJKcaeAi5tUFL1DTL2UE4zNRBcoShgo=BRoA3cG24pL%2Fqs32mdGEo8fOgeXPSdNCkienlRGZktAJc8vhquzUJQ%3D%3D&rUzwRPf%2BZ3zd4E7Ikn8Lyw%3D%3D=pwRE6AGJFLDNlh225F5QMaQWCtPHwdhUfCZ%2FLUQzgA2uL5jNRG4jdQ%3D%3D&mCTIbCubSFfXsDGW9IXnlg%3D%3D=hFflUdN3100%3D&kCx1AnS9%2FpWZQ40DXFvdEw%3D%3D=hFflUdN3100%3D&uJovDxwdjMPoYv%2BAJvYtyA%3D%3D=ctNJFf55vVA%3D&FgPlIEJYlotS%2BYGoBi5olA%3D%3D=NHdURQburHA%3D&d9Qjj0ag1Pd993jsyOJqFvmyB7X0CSQK=ctNJFf55vVA%3D&WGewmoAfeNR9xqBux0r1Q8Za60lavYmz=ctNJFf55vVA%3D&WGewmoAfeNQ16B2MHuCpMRKZMwaG1PaO=ctNJFf55vVA%3D,Climate Change | North Ayrshire Council,,,S12000021,Scotland,Scottish unitary authority,,
NDE,North Devon Council,Whole area,2030.0,Furthermore this Council calls on Westminster to provide the powers and resources to enable North Devon to work towards becoming carbon neutral as soon as possible bearing in mind the Intergovernmental Panel on Climate Change’s target of 2030.,https://democracy.northdevon.gov.uk/documents/g1003/Printed%20minutes%2024th-Jul-2019%2018.00%20Council.pdf?T=1,Climate Declaration | North Devon Council,,,E07000043,South West,Non-metropolitan district,DEV,
NECA,North East Combined Authority,No promise,,,,,,"No date mentioned - NECA has pledged to identify the additional powers and resources needed from government to support the shift towards net zero carbon, as well as maximising funding opportunities.

",E47000010,North East,Combined authority,,
NED,North East Derbyshire District Council,Council operations,2030.0,Make the Council’s activities net-zero carbon by 2030.,https://democracy.ne-derbyshire.gov.uk/documents/g1352/Printed%20minutes%2008th-Jul-2019%2015.00%20Council.pdf?T=1,Climate Declaration | North East Derbyshire District Council,,,E07000038,East Midlands,Non-metropolitan district,DBY,
NEL,North East Lincolnshire Council,Council operations,2050.0,"A climate emergency was declared in North East Lincolnshire in September 2019, when the Council confirmed its ambition to reduce its carbon emissions to zero by 2050. ",http://www.nelconservatives.org.uk/work-will-continue-to-combat-climate-change/,Combating Climate Change | North East Lincolnshire Council,,,E06000012,Yorkshire and The Humber,Unitary authority,,
NHE,North Hertfordshire District Council,Whole area,2030.0,"Most notably, in 2019, the Council passed a motion to declare a Climate Emergency, in this motion the Council pledged their commitment to do everything within its power to make North Hertfordshire Carbon Zero by 2030.",https://www.north-herts.gov.uk/sites/northherts-cms/files/Climate%20Change%20Strategy%202021-26%20.pdf,Climate Change Strategy | North Hertfordshire District Council,,,E07000099,East of England,Non-metropolitan district,HRT,
NKE,North Kesteven District Council,Unclear,2030.0,"Declares a ‘Climate Emergency’, and works with residents, businesses and other partners to tackle climate change, lobbying for support to address this emergency by 2030.",https://democracy.n-kesteven.gov.uk/ieListDocuments.aspx?CId=297&MId=7828&Ver=4,Climate Declaration | North Kesteven District Council,,,E07000139,East Midlands,Non-metropolitan district,LIN,
NLK,North Lanarkshire Council,Council operations,2030.0,"We’ve reduced our carbon footprint by 34% over a four-year period, already surpassing our 2022 target and going some way to achieving our ambitious aim for net zero emissions by 2030.",https://www.northlanarkshire.gov.uk/news/making-strides-reducing-our-carbon-footprint,Carbon Reduction | North Lanarkshire Council,,,S12000050,Scotland,Scottish unitary authority,,
NLK,North Lanarkshire Council,Whole area,2030.0,It has committed itself and the area of North Lanarkshire to achieving net zero emissions by 2030.,https://www.northlanarkshire.gov.uk/sites/default/files/2021-09/North%20Lanarkshire%27s%20Draft%20Climate%20Plan%20ACT2030.pdf,North Lanarkshire's Draft Climate Plan,,,S12000050,Scotland,Scottish unitary authority,,
NLN,North Lincolnshire Council,Unclear,2030.0,Achieve net zero carbon emissions by 2030.,https://www.northlincs.gov.uk/news/have-your-say-on-future-of-north-lincolnshires-environment/,Environment Consultations | https://www.northlincs.gov.uk/news/have-your-say-on-future-of-north-lincolnshires-environment/,,Public consultations taking place on this.,E06000013,Yorkshire and The Humber,Unitary authority,,
NNO,North Norfolk District Council,Council operations,2030.0,The steps that we are taking to achieve net-zero carbon emissions across our own estate and operations by 2030.,https://modgov.north-norfolk.gov.uk/documents/s6351/Environment%20Charter%20Appendix%20One%20-%20OS%20Final%20Draft.pdf,Our Environmental Charter | North Norfolk District Council,,,E07000147,East of England,Non-metropolitan district,NFK,
NNT,North Northamptonshire Council,Council operations,2030.0,North Northamptonshire Council has announced today that it is committed to becoming carbon neutral by 2030.,https://www.northnorthants.gov.uk/news/council-commits-being-carbon-neutral-2030,Council commits to being carbon neutral by 2030,,No notes,E06000061,East Midlands,Unitary authority,,
NSM,North Somerset Council,Whole area,2030.0,North Somerset aims to be a carbon neutral council and a carbon neutral area by 2030,https://www.n-somerset.gov.uk/sites/default/files/2020-02/North%20Somerset%20climate%20emergency%20strategy%202019.pdf,North Somerset Climate Emergency Strategy,,,E06000024,South West,Unitary authority,,
NTY,North Tyneside Metropolitan Borough Council,Whole area,2030.0,We will publish an action plan of the steps we will take and  the national investment we will seek to make North Tyneside carbon net zero by 2030.,https://democracy.northtyneside.gov.uk/documents/s14850/Carbon%20Net%20Zero%202030_Action%20Plan-Appendix%201.pdf,Carbon Net Zero 2030 | Action Plan 2023/24,,,E08000022,North East,Metropolitan district,,NTCA
NWA,North Warwickshire Borough Council,Council operations,2030.0,Make the Council’s activities net-zero carbon by 2030. ,https://www.google.com/url?sa=t&rct=j&q=&esrc=s&source=web&cd=&ved=2ahUKEwiTuMaTr9nzAhUqhv0HHc8eDjQQFnoECAcQAQ&url=https%3A%2F%2Fwww.northwarks.gov.uk%2Fdownload%2Fmeetings%2Fid%2F2237%2Fdownload_the_agenda_reports_and_appendices&usg=AOvVaw3wIVBiImZfRyRsB50nxp6C,Climate Declaration | North Warwickshire Borough Council,,,E07000218,West Midlands,Non-metropolitan district,WAR,
NWL,North West Leicestershire District Council,Council operations,2030.0,That this Council declares a climate emergency and will aim to achieve carbon neutrality from its own operations by 2030.,https://minutes-1.nwleics.gov.uk/ieListDocuments.aspx?CId=129&MId=1915&Ver=4,Climate Declaration | North West Leicestershire District Council,,,E07000134,East Midlands,Non-metropolitan district,LEC,
NWL,North West Leicestershire District Council,Whole area,2050.0,The climate emergency and the Council’s role in achieving Zero emissions by 2030 (Council’s direct emissions) and 2050 (whole district).,https://minutes-1.nwleics.gov.uk/documents/s27688/Annex%20A%20for%20Roadmap%20to%20Zero%20Carbon.pdf,Zero Carbon Roadmap | North West Leicestershire District Council,,,E07000134,East Midlands,Non-metropolitan district,LEC,
NYK,North Yorkshire County Council,Council operations,2030.0,"We have developed the below carbon reduction plan to help us reach our target of net-zero neutrality for the council by 2030, or as near to that date as possible.",https://www.northyorks.gov.uk/beyond-carbon,Beyond Carbon | North Yorkshire County Council,,,E10000023,,,,
NBL,Northumberland Council,Whole area,2030.0,"Our key target of a net-zero Northumberland by 2030 still stands. This is a huge amount of work, but far more will need to happen in order to meet our goal of a carbon neutral county.",https://www.northumberland.gov.uk/NorthumberlandCountyCouncil/media/About-the-Council/Climate%20change/Climate-change-action-plan-2021-23.pdf,Climate Change Action Plan | Northumberland Council,,,E06000057,North East,Unitary authority,,NTCA
NOW,Norwich City Council,Council operations,2030.0,Reducing CO2 emissions from council operations to achieve net zero by 2030.,https://www.norwich.gov.uk/info/20195/council_policies_and_strategies/3606/environmental_strategy_2020-25,Environmental Strategy | Norwich City Council,,,E07000148,East of England,Non-metropolitan district,NFK,
NGM,Nottingham City Council,Whole area,2028.0,Nottingham City Council has responded to the climate and environmental crisis by setting an ambition to become the first carbon neutral city in the UK by 2028.,https://www.nottinghamcity.gov.uk/media/2619917/2028-carbon-neutral-action-plan-v2-160620.pdf,Carbon Neutral Nottingham Action Plan,,,E06000018,East Midlands,Unitary authority,,
NTT,Nottinghamshire County Council,Council operations,2030.0,"In October 2020, the Council agreed to commit to carbon neutrality in all its activities by 2030 or as soon as possible thereafter.
",https://www.nottinghamshire.gov.uk/dms/Meetings/tabid/70/ctl/ViewMeetingPublic/mid/397/Meeting/5417/Committee/513/SelectedTab/Documents/Default.aspx,Climate Declaration | Nottinghamshire County Council,,,E10000024,East Midlands,County,,
NUN,Nuneaton and Bedworth Borough Council,Council operations,2030.0,"However at its Council meeting of 4 December 2019, Nuneaton and Bedworth Borough Council declared a climate emergency and in doing so committed to becoming a carbon neutral organisation by 2030. ",https://www.nuneatonandbedworth.gov.uk/climate-change,Climate Change | Nuneaton and Bedworth Borough Council,,,E07000219,West Midlands,Non-metropolitan district,WAR,
OAD,Oadby and Wigston Borough Council,Unclear,2030.0,We have a collective ambition of working towards being carbon neutral by 2030.,https://moderngov.oadby-wigston.gov.uk/documents/s22041/Climate%20Emergency%20Environment%20Strategy%20Action%20Plan%20-%20Update%20and%20Leicestershire%20Collective%20Vision%20.pdf,Climate Emergency: Environment Strategy & Action Plan | Oadby and Wigston Borough Council,,,E07000135,East Midlands,Non-metropolitan district,LEC,
OLD,Oldham Metropolitan Borough Council,Council operations,2025.0,"In July 2019, the Council committed to becoming a Green New Deal Council, setting targets of carbon neutrality for the Council by 2025.",https://www.climateemergency.uk/blog/oldham/,Climate Declaration | Oldham Metropolitan Borough Council,,,E08000004,North West,Metropolitan district,,GMCA
OLD,Oldham Metropolitan Borough Council,Whole area,2030.0,"In July 2019, the Council committed to becoming a Green New Deal Council, setting targets of carbon neutrality for the Council by 2025 and for the borough by 2030. ",https://www.oldham.gov.uk/news/article/1832/oldham_set_to_be_first_green_new_deal_council,Green Deal | Oldham Metropolitan Borough Council,,,E08000004,North West,Metropolitan district,,GMCA
ORK,Orkney Islands Council,No promise,,,,,,"Recognise need to ""Establishing a target timescale for zero emissions.""",S12000023,Scotland,Scottish unitary authority,,
OXO,Oxford City Council,Council operations,2030.0,"Delivering the City Council’s 4th Carbon Management Plan, which aims to achieve zero carbon by 2030.",https://www.oxford.gov.uk/news/article/1781/council_sets_out_action_plan_to_bring_about_a_zero_carbon_oxford_by_2040_or_earlier,Zero Carbon Oxford,,,E07000178,South East,Non-metropolitan district,OXF,
OXO,Oxford City Council,Whole area,2040.0,A net zero carbon city by 2040.,https://www.oxford.gov.uk/news/article/1781/council_sets_out_action_plan_to_bring_about_a_zero_carbon_oxford_by_2040_or_earlier,Zero Carbon Oxford,,,E07000178,South East,Non-metropolitan district,OXF,
OXF,Oxfordshire County Council,Council operations,2030.0,"Our commitment to be a zero carbon organization by 2030, and fully playing our part in creating a zero carbon Oxfordshire.",https://www.oxfordshire.gov.uk/residents/environment-and-planning/energy-and-climate-change/what-we-are-doing,Reducing Greenhouse Gas | Oxfordshire County Council,,,E10000025,South East,County,,
OXF,Oxfordshire County Council,Whole area,2050.0,Enable a net-zero Carbon Oxfordshire by 2050.,https://www.oxfordshire.gov.uk/residents/environment-and-planning/energy-and-climate-change/what-we-are-doing,Reducing Greenhouse Gas | Oxfordshire County Council,,,E10000025,South East,County,,
PEM,Pembrokeshire County Council,Council operations,2030.0,"The Council has announced a climate emergency, and an action plan is in place to steer Pembrokeshire County Council towards becoming a net zero-carbon local authority by 2030.",https://www.pembrokeshire.gov.uk/newsroom/solar-car-parking-canopies-installed-as-part-of-energy-efficiency-project,Energy Efficiency | Pembrokeshire County Council,,,W06000009,Wales,Welsh unitary authority,,
PEN,Pendle Borough Council,Council operations,2030.0,"We have a target for Pendle Council to be carbon-neutral by 2030 and we’re working to reduce our carbon footprint year on year.

",https://www.pendle.gov.uk/info/20003/community/567/climate_change,Climate Change | Pendle Borough Council,,,E07000122,North West,Non-metropolitan district,LAN,
PKN,Perth and Kinross Council,Whole area,2045.0,"Recent legislation however, gives a clear role for the Council to work with its partners, citizens and businesses to ensure that the whole Perth & Kinross area becomes a net zero carbon place by 2045 at the latest. ",https://www.pkc.gov.uk/climatechange,Climate change | Perth and Kinross Council,,,S12000048,Scotland,Scottish unitary authority,,
PTE,Peterborough City Council,Whole area,2030.0,"In July 2019, Peterborough City Council declared a climate emergency. This is because we recognise that the impacts of climate breakdown are already causing serious damage to our world and we need to take urgent action. For our part, we have committed to make the council’s activities net-zero carbon by 2030, and to also help Peterborough become a net-zero carbon city by 2030.",https://www.peterborough.gov.uk/council/campaigns/climate-change,Climate Change | Peterborough City Council,,,E06000031,East of England,Unitary authority,,CPCA
PLY,Plymouth City Council,Whole area,2030.0,Tackling climate change is one of the Council’s top priorities and so in March 2019 we declared a Climate Emergency and pledged to make Plymouth carbon neutral by 2030.,https://www.plymouth.gov.uk/environmentandpollution/climateemergency,Climate emergency | Plymouth City Council,,,E06000026,South West,Unitary authority,,
POR,Portsmouth City Council,Whole area,2030.0,"Pledge to achieve net zero carbon emissions in the Portsmouth by 2030, considering, both production and consumption of emissions according to the Standard provided by the Greenhouse Gas (GHG) Protocol.",https://democracy.portsmouth.gov.uk/documents/s25687/Response%20to%20Climate%20Emergency%20Strategy%20appendix%20A.pdf?_ga=2.1382129.1754801034.1601400443-1900179378.1601400443,Portsmouth City Council Climate Emergency Strategy,,,E06000044,South East,Unitary authority,,
