local-authority-code,council,scope,target,wording,source_url,source_name,data_checked,notes,gss_code,region,local-authority-type-name,county-la,combined-authority
DUR,Durham County Council,Whole area,2050.0,Investigate what further actions are necessary to make County Durham carbon neutral by 2050 and pledge to achieve this.,https://democracy.durham.gov.uk/documents/s119824/7%20Climate%20Change%20Action%20Plan%202020.pdf,Climate Emergency Response | Durham County Council,,,E06000047,North East,Unitary authority,,NECA
EAY,East Ayrshire Council,Council operations,2030.0,"Agree to join the UK100 and endorse their Net Zero Local Leadership Pledge, which would commit the Council to the aim of reducingthe council’s carbonemissions to Net Zero by 2030.",https://docs.east-ayrshire.gov.uk/r/?f=https://docs.east-ayrshire.gov.uk/CRPADMMIN/2012%20AGENDAS/COUNCIL/24%20JUNE%202021/east%20ayrshire%20climate%20change%20strategy.pdf,East Ayrshire Climate Change Strategy ,,,S12000008,Scotland,Scottish unitary authority,,
EAY,East Ayrshire Council,Whole area,2045.0,Work  with  our  residents  and  businesses  to  bring  our  wider communities’ emissions in line with Net Zero as soon as possible (and by 2045 at the latest).,https://docs.east-ayrshire.gov.uk/r/?f=https://docs.east-ayrshire.gov.uk/CRPADMMIN/2012%20AGENDAS/COUNCIL/24%20JUNE%202021/east%20ayrshire%20climate%20change%20strategy.pdf,East Ayrshire Climate Change Strategy ,,,S12000008,Scotland,Scottish unitary authority,,
ECA,East Cambridgeshire District Council,Whole area,2050.0,"Our vision for 2050 is to deliver net zero carbon emissions for the Council’s operations and, in partnership with all stakeholders, for East Cambridgeshire as a whole, with clear and demonstrable progress towards that target year on year.",https://www.eastcambs.gov.uk/sites/default/files/agendas/5%20-%20080620%20V12%20ApA.pdf,Environmental Plan | East Cambridgeshire District Council,,,E07000009,East of England,Non-metropolitan district,CAM,CPCA
EDE,East Devon District Council,Council operations,2040.0,"Our targets , Carbon emissions: To reduce our carbon emissions annually, and to be carbon neutral by 2040.",https://eastdevon.gov.uk/media/3721245/eddc-climate-change-strategy-final-acc.pdf,East Devon District Council Climate Change Strategy,,,E07000040,South West,Non-metropolitan district,DEV,
EDU,East Dunbartonshire Council,Council operations,2045.0,"East Dunbartonshire Council recognises the need for urgent and decisive action on climate change and will set new carbon reduction targets in 2020 via the Council’s revised CMP, which will set out
how the Council will contribute to the substantially more ambitious targets that are included in the Climate Change (Emissions Reduction Targets) (Scotland) Act 2019, including the need for a 75% reduction in emissions by 2030, a 90% reduction by 2040 and net-zero by 2045. ",https://www.eastdunbarton.gov.uk/filedepot_download/18520/1602,"East Dunbartonshire
Sustainability and Climate Change Framework",,,S12000045,Scotland,Scottish unitary authority,,
EHA,East Hampshire District Council,Council operations,2050.0,To reduce carbon emissions in line with the Climate Change Act 2008 to be net-zero by 2050 for all Council services...This is a strategy for East Hampshire District Council (rather than the county of Hampshire.,"https://cdn.easthants.gov.uk/public/documents/Climate%20Environment%20Strategy%202020-25.pdf#:~:text=East%20Hampshire%20District%20Council%20will%20make%20operations%20net%2Dzero%20as,government%20to%20support%20this%20ambition.&text=East%20Hampshire%20a%20carbon%20neutral%20district.,-We%20want%20the","East Hampshire District Council
Climate and Environment Strategy 2020-2025",,,E07000085,South East,Non-metropolitan district,HAM,
EHE,East Hertfordshire District Council,Whole area,2030.0,Our aim is to achieve carbon neutrality for East Herts Council's own generated emissions by 2030 and do all that we can to assist in achieving carbon neutrality by the same year for the wider district.,https://www.eastherts.gov.uk/about-east-herts-0/environmental-sustainability/environmental-sustainability-action-plan,Environmental Sustainability Action Plan | East Hertfordshire District Council,,,E07000242,East of England,Non-metropolitan district,HRT,
ELI,East Lindsey District Council,Council operations,2040.0,"To lead by example and encourage the District as a whole to undertake similar steps, ELDC is committing to an ambitious target of reducing its carbon emissions to net zero by 2040, with a minimum emissions reduction of 45% by 2027.","https://www.e-lindsey.gov.uk/media/17770/Carbon-Reduction-Plan-FINAL/pdf/ELDC_Carbon_Reduction_Plan_FINAL.pdf?m=637468277559600000#:~:text=East%20Lindsey%20District%20Council%20has,reduction%20of%2045%25%20by%202027.",Carbon Reduction Plan | East Lindsey District Council,,,E07000137,East Midlands,Non-metropolitan district,LIN,
ELN,East Lothian Council,Council operations,2045.0,"East Lothian Council will take urgent action to make all our Council Services Net Zero as soon as reasonably practicable or in any case by 2045 and will lobby, support and work with government, all relevant agencies, partners and communities to fulfil this commitment.",https://www.eastlothian.gov.uk/downloads/file/29179/climate_change_strategy_2020-2025,Climate Change Strategy | East Lothian Council,,,S12000010,Scotland,Scottish unitary authority,,
ERW,East Renfrewshire Council,Council operations,2040.0,Supports the ambition for the Council to be ‘carbon neutral’ by 2040 ( as a minimum target).,https://eastrenfrewshire.gov.uk/media/1772/Cabinet-Supplementary-Papers-13-August-2020/pdf/Cabinet_Supplementary_Papers_-_13_August_2020.pdf?m=637322255037000000,Climate Change Strategy and Action Plan | East Renfrewshire Council,,,S12000011,Scotland,Scottish unitary authority,,
ERY,East Riding of Yorkshire Council,Council operations,2050.0,"The Council has an ambition to be net-zero carbon by 2050 in line with the Governments’ target…. It was important for the Panel to recognise that 
councils could only commit to a target of net zero 
for their own services and activities.",https://downloads.eastriding.org.uk/corporate/committees/overview-and-scrutiny/review-panels/Climate%20Change%20-%20Review%20Panel%20Report-%20January%202021.pdf,Change Change Review | East Riding of Yorkshire Council,,,E06000011,Yorkshire and The Humber,Unitary authority,,
EST,East Staffordshire Borough Council,Council operations,2040.0,Reduce Carbon Emissions from our own activities to achieve Carbon Neutrality by 2040.,https://www.eaststaffsbc.gov.uk/sites/default/files/docs/cmis/meetings/CCL%20200817%2005c%20Appendix%202-%20Action%20Plan%20v6.pdf,Climate Action Plan | East Staffordshire Borough Council,,,E07000193,West Midlands,Non-metropolitan district,STS,
ESX,East Sussex County Council,Council operations,2050.0,"Declared a climate emergency in October 2019 and committed to becoming carbon neutral from its own activities as soon as possible, and by 2050 at the latest.",https://www.eastsussex.gov.uk/media/15770/escc-climate-emergency-plan-june-2020.pdf,East Sussex County Council’s Climate Emergency Plan,,,E10000011,South East,County,,
EAS,Eastbourne Borough Council,Whole area,2030.0,We have stated that we wish to “achieve a carbon neutral town by 2030”.,https://democracy.lewes-eastbourne.gov.uk/documents/s18264/Eastbourne%20Carbon%20Neutral%202030%20A%20Plan%20for%20Action%20-%20Appendix%201%20Climate%20Emergency%20Strategy.pdf,Eastbourne Borough Council Climate Emergency Strategy,,,E07000061,South East,Non-metropolitan district,ESX,
EAT,Eastleigh Borough Council,Council operations,2025.0,Put in place measures to ensure the Council’s own operations and functions achieve carbon neutrality by 2025.,https://www.eastleigh.gov.uk/media/6355/climate-change-and-environmental-emergency-strategy-2020-2030.pdf,Climate and Environmental Strategy | Eastleigh Borough Council,,,E07000086,South East,Non-metropolitan district,HAM,
EAT,Eastleigh Borough Council,Whole area,2030.0,Establish a cross-party working group to develop a plan for how the Borough of Eastleigh could achieve carbon neutrality by 2030.,https://www.eastleigh.gov.uk/media/6355/climate-change-and-environmental-emergency-strategy-2020-2030.pdf,Climate and Environmental Strategy | Eastleigh Borough Council,,,E07000086,South East,Non-metropolitan district,HAM,
EDN,Eden District Council,Whole area,2030.0,"Work together with other councils, public and private sector organisations (within Eden, Cumbria, the UK and internationally) to determine and implement best practice methods to achieve zero emissions in Eden District by 2030.",https://democracy.eden.gov.uk/documents/g2617/Printed%20minutes%2011th-Jul-2019%2018.45%20Council.pdf?T=1,Climate Commitments | Eden District Council,,,E07000030,,,,
ELM,Elmbridge Borough Council,Whole area,2030.0,"This Council therefore calls on the Cabinet to: Declare a ‘Climate Emergency’; Pledge to make Elmbridge carbon neutral by 2030, taking into account both production and consumption emissions.",http://mygov.elmbridge.gov.uk/mgAi.aspx?ID=11369,Climate Commitments | Elmbridge Borough Council,,,E07000207,South East,Non-metropolitan district,SRY,
EPP,Epping Forest District Council,Council operations,2030.0,In recognition of this the Council declared a climate emergency in September 2019 and set itself a target of ensuring its own buildings and operations are carbon neutral by 2030.,https://www.eppingforestdc.gov.uk/wp-content/uploads/2020/06/Draft%20green%20infrastructure%20strategy.pdf,Green Infrastructure Strategy | Epping Forest District Council,,,E07000072,East of England,Non-metropolitan district,ESS,
EPP,Epping Forest District Council,Whole area,2030.0,To note that an action plan will be developed to cut across all relevant service areas to deliver the Council’s resolution to declare a climate emergency and its pledge to do everything within its power to make the Epping Forest District carbon neutral by 2030.,https://rds.eppingforestdc.gov.uk/documents/s94920/Climate%20Emergency.pdf,Climate Emergency Meeting | Epping Forest District Council,,,E07000072,East of England,Non-metropolitan district,ESS,
EPS,Epsom and Ewell Borough Council,Council operations,2035.0,Climate change target of 2035 for the Council's operations to be net carbon neutral.,https://www.epsom-ewell.gov.uk/sites/default/files/documents/Climate%20Change%20Action%20Plan%20Final.pdf,Climate Action Plan | Epsom and Ewell Borough Council,,,E07000208,South East,Non-metropolitan district,SRY,
ERE,Erewash Borough Council,Council operations,2050.0,"Commit to reducing net carbon emissions to zero by 2050 in line government targets.
",http://www.erewash.gov.uk/images/Performance_and_Community/Corporate_Plan_2021_to_2023.pdf,Corporate Plan | Erewash Borough Council,,,E07000036,East Midlands,Non-metropolitan district,DBY,
ESS,Essex County Council,Council operations,2030.0,"In today’s meeting, ECC’s Cabinet agreed to a range of climate mitigation initiatives, that include:
a policy to transform its estate to have net zero greenhouse emissions by 2030.",https://www.essex.gov.uk/news/county-council-responds-to-climate-action-commission-interim-report,Climate Response | Essex County Council,,,E10000012,East of England,County,,
EXE,Exeter City Council,Whole area,2030.0,This Plan presents Exeter's view of how the city can achieve its ambition to be net-zero carbon by 2030.,https://www.exetercityfutures.com/wp-content/uploads/2020/05/Net-Zero-Exeter-2030-Plan-PU.pdf,Net Zero Exeter Plan 2030,,,E07000041,South West,Non-metropolitan district,DEV,
FAL,Falkirk Council,Unclear,2030.0,"In August 2019, Falkirk Council declared a Climate Emergency and “agreed to push towards increasing our efforts to reduce our carbon emissions to net zero by 2030 while making Grangemouth our first carbon neutral town”.",https://www.falkirk.gov.uk/services/environment/environmental-policy/climate-change/scotlands-climate-change-legislation.aspx,Climate Change Legislation | Falkirk Council,,,S12000014,Scotland,Scottish unitary authority,,
FAR,Fareham Borough Council,Council operations,2030.0,Our goal is to be carbon neutral by 2030.,https://www.fareham.gov.uk/PDF/about_the_council/protecting_the_environment/FBCClimateChangeActionPlan.pdf,Fareham Borough Council Climate Change Action Plan,,,E07000087,South East,Non-metropolitan district,HAM,
FEN,Fenland District Council,No promise,,,,,,No notes,E07000010,East of England,Non-metropolitan district,CAM,CPCA
FIF,Fife Council,Council operations,2045.0,"It is Fife Council’s ambition to work with local and national partners to achieve the latest climate change targets, requiring Fife to achieve a net zero emissions target by 2045.",https://www.fife.gov.uk/__data/assets/pdf_file/0028/219970/Climate-Fife-Sustainable-Energy-and-Climate-Action-Plan-2020-2030.pdf,Climate Fife: Sustainable Energy and Climate Action Plan,,,S12000047,Scotland,Scottish unitary authority,,
FLN,Flintshire County Council,No promise,,,,,,No notes,W06000005,Wales,Welsh unitary authority,,
SHE,Folkestone and Hythe District Council,Council operations,2030.0,Folkestone and Hythe District Council has committed to reducing its own carbon footprint to a net zero target by 2030.,https://folkestone-hythe.gov.uk/media/3365/Carbon-Action-Plan/pdf/F_HDC_Carbon_Action_Plan.pdf?m=637511455571400000,Folkestone & Hythe District Carbon Action Plan,,,E07000112,South East,Non-metropolitan district,KEN,
FOE,Forest of Dean District Council,Council operations,2030.0,Make the Forest of Dean District Council carbon neutral by 2030.,https://www.fdean.gov.uk/media/le3ivv5b/climate-emergency-rapid-action-plan.pdf,Climate Emergency Rapid Action Plan,,,E07000080,South West,Non-metropolitan district,GLS,
FOE,Forest of Dean District Council,Whole area,2030.0,Make the Forest of Dean District carbon neutral by 2030.,https://www.fdean.gov.uk/media/le3ivv5b/climate-emergency-rapid-action-plan.pdf,Climate Emergency Rapid Action Plan,,,E07000080,South West,Non-metropolitan district,GLS,
FYL,Fylde Borough Council,No promise,,,,,,"""The councils are working together and within their localities. For Fylde Council to achieve our net-zero target, it is important to understand where we are now. This means determining the amount of greenhouse gas emissions that are currently being produced from both council operations and across Fylde."" but no date given",E07000119,North West,Non-metropolitan district,LAN,
GAT,Gateshead Metropolitan Borough Council,Council operations,2030.0,"Gateshead Council declared a Climate Emergency at its Council meeting on 23 May 2019. In doing so, the council committed to:  • Make the Council’s activities carbon neutral by 2030    • Achieve 100% clean energy across the Council’s full range of functions by 2030.   ",https://www.gateshead.gov.uk/media/24966/Climate-Emergency-Action-Plan/pdf/3336-MC-Climate_emergency_Action_Plan_v22.pdf?m=637503784846170000,"Climate Emergency
Action Plan | Gateshead Metropolitan Borough Council",,,E08000037,North East,Metropolitan district,,NECA
GAT,Gateshead Metropolitan Borough Council,Whole area,2030.0,Support and work with all other relevant agencies towards making the entire area carbon neutral within the same timescale [2030].,https://www.gateshead.gov.uk/article/14171/What-Gateshead-Council-is-doing#cookie-consents-updated,"What Gateshead Council is doing
",,,E08000037,North East,Metropolitan district,,NECA
GED,Gedling Borough Council,Council operations,2030.0,"In November 2019, Gedling Borough Council (GBC) declared a climate emergency, alongside which a pledge to achieve net-zero carbon emissions by 2030 was made.",https://democracy.gedling.gov.uk/documents/s28664/final-Carbon%20Management%20Strategy%20Sep%2021%20Inc%20all%20internal__%20comments%201.pdf,Carbon Management Strategy | Gedling Borough Council,,,E07000173,East Midlands,Non-metropolitan district,NTT,
GLG,Glasgow City Council,Whole area,2030.0,"Principal amongst these recommendations was one
for the city to become carbon neutral city by 2030, which was endorsed by the city.",https://www.glasgow.gov.uk/CHttpHandler.ashx?id=50623&p=0,Glasgow’s Climate Plan,,,S12000049,Scotland,Scottish unitary authority,,
GLO,Gloucester City Council,Council operations,2030.0,This committed the Council to becoming carbon neutral by 2030.,http://democracy.gloucester.gov.uk/documents/s51122/Tackling%20Cimate%20Change%20Road%20Map.pdf,Climate Commitments | Gloucester City Council,,,E07000081,South West,Non-metropolitan district,GLS,
GLO,Gloucester City Council,Whole area,2050.0,This committed the Council to becoming carbon neutral by 2030 and the City as whole by 2050.,http://democracy.gloucester.gov.uk/documents/s51122/Tackling%20Cimate%20Change%20Road%20Map.pdf,Climate Commitments | Gloucester City Council,,,E07000081,South West,Non-metropolitan district,GLS,
GLS,Gloucestershire County Council,Council operations,2030.0,Our declaration in May 2019 included commitments for us to be net zero by 2030.,https://www.gloucestershire.gov.uk/media/2094404/gloucestershire-climate-change-strategy.pdf,Gloucestershire’s Climate Change Strategy,,,E10000013,South West,County,,
GLS,Gloucestershire County Council,Whole area,2050.0,"By 2050 we will create a carbon neutral county that provides quality of life now and for future generations, having improved the quality of our natural environment.",https://www.gloucestershire.gov.uk/media/2094404/gloucestershire-climate-change-strategy.pdf,Gloucestershire’s Climate Change Strategy,,,E10000013,South West,County,,
GOS,Gosport Borough Council,Council operations,2050.0,To be carbon neutral for the Council's own operations (scope 1 and 2) by 2050 or sooner.,https://www.gosport.gov.uk/article/2068/The-Council-s-response-to-the-climate-crisis,The Council's response to the climate crisis,,,E07000088,South East,Non-metropolitan district,HAM,
GRA,Gravesham Borough Council,Council operations,2030.0,"Pledge to do what is within its powers and resources to make Gravesham Borough Council carbon neutral by 2030, taking into account both production and consumption emissions.",http://democracy.gravesham.gov.uk/documents/s56626/Report%20-%20Climate%20Change%20Emergency.pdf,Climate Commitments | Gravesham Borough Council,,,E07000109,South East,Non-metropolitan district,KEN,
GRA,Gravesham Borough Council,Whole area,2030.0,Gravesham Borough Council with this motion declares we have a climate emergency and we will begin to take action to prepare for the borough to become carbon neutral by 2030.,http://democracy.gravesham.gov.uk/documents/s56626/Report%20-%20Climate%20Change%20Emergency.pdf,Climate Commitments | Gravesham Borough Council,,,E07000109,South East,Non-metropolitan district,KEN,
GRY,Great Yarmouth Borough Council,No promise,,,,,,No notes,E07000145,East of England,Non-metropolitan district,NFK,
GMCA,Greater Manchester Combined Authority,Whole area,2038.0,Mission: Urgent action is needed to put Greater Manchester on a path to carbon neutrality by 2038.,https://www.greatermanchester-ca.gov.uk/media/1975/5_year_plan_exec_summ_digital.pdf,5 Year Environment Plan For Greater Manchester,,,E47000001,North West,Combined authority,,
GRT,Guildford Borough Council,Whole area,2030.0,"As a result of this, the Council formally declared a climate emergency and set a goal for the borough to reach net zero emissions by 2030.",https://www.guildford.gov.uk/media/32748/Climate-Change-Sustainable-Design-Construction-and-Energy-SPD/pdf/Climate_Change__Sustainable_Design__Construction_and_Energy_SPD.pdf?m=638012624947270000,"Climate Change, Sustainable Design, Construction and Energy | Guildford Borough Council",,,E07000209,South East,Non-metropolitan district,SRY,
GWN,Gwynedd County Council,Whole area,2030.0,"Call on Welsh Government and the Westminster Government to provide
the requisite powers and resources to achieve the target of a carbon-free Gwynedd by 2030.",https://democracy.gwynedd.llyw.cymru//documents/s25532/Climate%20Change%20Emergency%20Plan.pdf,Climate Change Emergency Plan | Gwynedd County Council,,,W06000002,Wales,Welsh unitary authority,,
HAL,Halton Borough Council,No promise,,,,,,,E06000006,North West,Unitary authority,,LCR
HAE,Hambleton District Council,Council operations,2034.0,Hambleton District Council’s Climate Change Strategy looks at how the authority can work towards achieving our target of net zero CO2 emissions by 2034.,https://democracy.hambleton.gov.uk/documents/s24106/Annex%20B%20Climate%20Change%20Strategy%20and%20Action%20Plan%20202.pdf,"Climate Change
Strategy and
Action Plan | Hambleton District Council",,,E07000164,,,,
HAM,Hampshire County Council,Council operations,2050.0,"Two targets have been set for the County Council, and these also apply to Hampshire as a whole:

2050 - carbon neutral",https://www.hants.gov.uk/climatechange,Hampshire County Council Climate Change Strategy,20/11/23,IB found,E10000014,South East,County,,
HAM,Hampshire County Council,Whole area,2050.0,"Two targets have been set for the County Council, and these also apply to Hampshire as a whole:

2050 - carbon neutral",https://www.hants.gov.uk/climatechange,Hampshire County Council Climate Change Strategy,20/11/23,IB found,E10000014,South East,County,,
HAO,Harborough District Council,Council operations,2030.0,"The Council has committed to reducing its own emission to zero, as far as practically possible, by 2030.",https://cmis.harborough.gov.uk/CMIS5/Document.ashx?czJKcaeAi5tUFL1DTL2UE4zNRBcoShgo=IYqA8IpDrNC0qk04GJo5NJq%2b4Y4h3RPYGT5skVIzH7X8%2b%2flMFhOS%2bg%3d%3d&rUzwRPf%2bZ3zd4E7Ikn8Lyw%3d%3d=pwRE6AGJFLDNlh225F5QMaQWCtPHwdhUfCZ%2fLUQzgA2uL5jNRG4jdQ%3d%3d&mCTIbCubSFfXsDGW9IXnlg%3d%3d=hFflUdN3100%3d&kCx1AnS9%2fpWZQ40DXFvdEw%3d%3d=hFflUdN3100%3d&uJovDxwdjMPoYv%2bAJvYtyA%3d%3d=ctNJFf55vVA%3d&FgPlIEJYlotS%2bYGoBi5olA%3d%3d=NHdURQburHA%3d&d9Qjj0ag1Pd993jsyOJqFvmyB7X0CSQK=ctNJFf55vVA%3d&WGewmoAfeNR9xqBux0r1Q8Za60lavYmz=ctNJFf55vVA%3d&WGewmoAfeNQ16B2MHuCpMRKZMwaG1PaO=ctNJFf55vVA%3d,Harborough District Council Climate Emergency Action Plan 2020 to 2025,,,E07000131,East Midlands,Non-metropolitan district,LEC,
HAR,Harlow Council,Whole area,2030.0,"Aim to make London borough of Harrow carbon neutral by 2030, taking into account both production and consumption of emissions.",https://moderngov.harrow.gov.uk/documents/g64599/Public%20reports%20pack%20Thursday%2018-Jul-2019%2019.30%20Council.pdf?T=10,Climate Commitments | Harlow Council,,,E07000073,East of England,Non-metropolitan district,ESS,
HAG,Harrogate Borough Council,Council operations,2038.0,"By 2038 we will have a net zero-carbon economy. The council’s own operations will be clean and efficient, and we will play a positive role enabling the wider district to achieve net-zero emissions.",https://www.harrogate.gov.uk/downloads/file/1497/carbon-reduction-strategy,Carbon Reduction Strategy | Harrogate Borough Council,,,E07000165,,,,
HAT,Hart District Council,Council operations,2040.0,At its meeting in September 2019 Cabinet agreed to prepare a Climate Change Strategy and Action Plan based on the Council becoming a net zero carbon emitter by 2040 at the latest.,https://www.hart.gov.uk/sites/default/files/4_The_Council/Council_meetings/B_February/20%2002%2006%20Climate%20Change%20Action%20Plan.pdf,Climate Change Action Plan | Hart District Council,,,E07000089,South East,Non-metropolitan district,HAM,
HPL,Hartlepool Borough Council,No promise,,,,,,No notes,E06000001,North East,Unitary authority,,TVCA
HAS,Hastings Borough Council,Council operations,2030.0,"Hastings Borough Council declared a climate emergency and committed to preparing a report, outlining how to reduce carbon emissions and work towards becoming carbon neutral by 2030.",https://www.hastings.gov.uk/my-council/climate-change/,Tackling climate change | Hastings Borough Council,,,E07000062,South East,Non-metropolitan district,ESX,
HAA,Havant Borough Council,Council operations,2050.0,The first objective laid out in this document is for the Council to reach carbon net-zero operation by or before 2050.,https://havant.moderngov.co.uk/documents/s38874/210908%20Havant%20BC%20Climate%20Change%20Strategy%20Final.pdf,"Havant Borough Council
Climate Change and Environment Strategy",,,E07000090,South East,Non-metropolitan district,HAM,
HEF,Herefordshire Council,Council operations,2030.0,"Commit to an accelerated reduction of its own carbon emissions, with theaspirations to be carbon neutral by 2030; and to change its energy supply to 100%renewable source.",https://councillors.herefordshire.gov.uk/documents/s50065003/Notices%20of%20Motion%20Council%20-%208%20March%202019.pdf,Climate Commitments | Herefordshire Council,,,E06000019,West Midlands,Unitary authority,,
HEF,Herefordshire Council,Whole area,2030.0,"Work with strategic partners, residents and local organisations to develop a revised countywide carbon dioxide reduction strategy aspiring for carbon neutrality by 2030.",https://www.herefordshire.gov.uk/climate-2/climate-change,Our climate emergency declaration | Herefordshire Council,,,E06000019,West Midlands,Unitary authority,,
HRT,Hertfordshire County Council,Council operations,2030.0,A carbon neutral organisation by 2030.,https://democracy.hertfordshire.gov.uk/documents/s16858/Late%20Report-Item%204-App%20A-Sustainable%20Hertfordshire%20Strategy%202020.pdf,Sustainability Strategy | Hertfordshire County Council,,,E10000015,East of England,County,,
HRT,Hertfordshire County Council,Whole area,2050.0,A net zero greenhouse gas county before 2050.,https://democracy.hertfordshire.gov.uk/documents/s16858/Late%20Report-Item%204-App%20A-Sustainable%20Hertfordshire%20Strategy%202020.pdf,Sustainability Strategy | Hertfordshire County Council,,,E10000015,East of England,County,,
