local-authority-code,council,scope,target,wording,source_url,source_name,data_checked,notes,gss_code,region,local-authority-type-name,county-la,combined-authority
ABE,Aberdeen City Council,Council operations,2045.0,"In March 2021, the Council Climate Change Plan 2021-25: Towards a Net Zero and Climate Resilient Council was approved. The Plan and accompanying Project Register set out the approach, pathway and actions towards net zero and climate resilient Council assets and operations, by 2045.",https://www.aberdeencity.gov.uk/services/environment/climate-change,Climate change | Aberdeen City Council,,,S12000033,Scotland,Scottish unitary authority,,
ABE,Aberdeen City Council,Whole area,,Our aim is to be a true national and international exemplar by becoming a climate positive city as soon as possible.,https://www.aberdeencity.gov.uk/sites/default/files/2021-03/Aberdeen%20Energy%20Transition%20Vision%202020_0.pdf,Aberdeen Energy Transition Vision 2020,,,S12000033,Scotland,Scottish unitary authority,,
ABD,Aberdeenshire Council,Council operations,2045.0,Aberdeenshire Council has a target of 75% by 2030 and Net Zero by 2045 from the 2010/11 baseline year.,https://www.aberdeenshire.gov.uk/environment/green-living/environmental-policy/,Climate change and sustainability - Aberdeenshire Council,,,S12000034,Scotland,Scottish unitary authority,,
ABD,Aberdeenshire Council,Whole area,2045.0,"We will […] work with others across the region to ensure that Aberdeenshire reaches Net 
Zero by 2045, by promoting energy transition and a circular economy",https://www.aberdeenshire.gov.uk/media/25146/climatechangedeclaration.pdf,Aberdeenshire Council Climate Change Declaration,,,S12000034,Scotland,Scottish unitary authority,,
ADU,Adur District Council,Council operations,2030.0,Adur & Worthing Councils declared a climate emergency in July 2019. As part of this declaration we made a commitment to work towards being a carbon neutral council by 2030.,https://www.adur-worthing.gov.uk/sustainable-aw/carbon-reduction/,Reducing carbon emissions - Adur & Worthing Councils,,Joint administration with Worthing Borough Council,E07000223,South East,Non-metropolitan district,WSX,
ADU,Adur District Council,Whole area,2050.0,"Adur & Worthing Councils have committed to working towards carbon neutrality 
by 2030 for the councils own direct emissions, and 2050 for area-wide emissions, 
supporting the UK’s Net Zero by 2050 commitments and the Paris Agreement.","https://www.adur-worthing.gov.uk/media/Media,159036,smxx.pdf",SCATTER Study for Adur & Worthing,,Joint administration with Worthing Borough Council,E07000223,South East,Non-metropolitan district,WSX,
ALL,Allerdale Borough Council,Whole area,2030.0,"The [Allerdale Partnership Climate Change] group will consider strategies and actions being developed by the council and other partner organisations and develop a borough-wide strategy in line with a target of net zero emissions by 2030, engaging other anchor institutions and SMEs.",https://www.allerdale.gov.uk/en/your-environment/climate-change/,Climate change - Allerdale Borough Council,,,E07000026,,,,
AMB,Amber Valley Borough Council,Council operations,2030.0,"Committed to addressing the issue of climate change, Amber Valley Borough Council has declared its aim to become carbon-neutral by 2030.",https://www.ambervalley.gov.uk/community/climate-change/,Climate change - Amber Valley Borough Council,,,E07000032,East Midlands,Non-metropolitan district,DBY,
ANS,Angus Council,No promise,,,,,,"No specific promise, other than ""contributing to"" Scotland’s 2045 carbon zero target",S12000041,Scotland,Scottish unitary authority,,
ANN,Antrim and Newtownabbey Borough Council,No promise,,,,,,none,N09000001,Northern Ireland,NI district,,
AND,Ards and North Down Borough Council,No promise,,,,,,none,N09000011,Northern Ireland,NI district,,
AGB,Argyll and Bute Council,Council operations,2045.0,This will be a new reference point for our own journey towards being a ‘net zero’ organisation by 2045,https://www.argyll-bute.gov.uk/sites/default/files/decarbonisation_plan_-_final.pdf,Argyll and Bute Council Decarbonisation Plan 2021,,,S12000035,Scotland,Scottish unitary authority,,
ABC,"Armagh City, Banbridge and Craigavon Borough Council",No promise,,,,,,none,N09000002,Northern Ireland,NI district,,
ARU,Arun District Council,Council operations,2030.0,"We declared a climate emergency on 15th January 2020.  As a council, we pledged to be carbon neutral by 2030.",https://www.arun.gov.uk/climate-change,Climate change | Arun District Council,,,E07000224,South East,Non-metropolitan district,WSX,
ASH,Ashfield District Council,No promise,,,,,,none,E07000170,East Midlands,Non-metropolitan district,NTT,
ASF,Ashford Borough Council,Council operations,2030.0,"Ashford Borough and Ashford Borough Council will aim to become carbon neutral by 2030, and 80% by 2025.",https://www.ashford.gov.uk/environmental-concerns/carbon-neutral-agenda/,Carbon Neutral Agenda | Ashford Borough Council,,,E07000105,South East,Non-metropolitan district,KEN,
ASF,Ashford Borough Council,Whole area,2030.0,"Ashford Borough and Ashford Borough Council will aim to become carbon neutral by 2030, and 80% by 2025.",https://www.ashford.gov.uk/environmental-concerns/carbon-neutral-agenda/,Carbon Neutral Agenda | Ashford Borough Council,,,E07000105,South East,Non-metropolitan district,KEN,
BAB,Babergh District Council,Council operations,2030.0,"This Council pledges to:
1. Acknowledge a climate emergency.
2. Set up a Task Force, commencing by September 2019, to examine ways in which Babergh & Mid Suffolk Councils will respond to the climate change challenge on a spend to save basis, with the ambition to make Babergh & Mid Suffolk Councils carbon neutral by 2030.",https://baberghmidsuffolk.moderngov.co.uk/mgAi.aspx?ID=9968,Climate Declaration | Babergh Council,,,E07000200,East of England,Non-metropolitan district,SFK,
BNS,Barnsley Metropolitan Borough Council,Council operations,2040.0,Barnsley Council set out in its climate emergency declaration in September 2019 an ambitious and realistic vision for the borough to become net Zero Carbon by 2045 (Zero45) and as an organisation to lead by example to become net zero carbon by 2040 (Zero40).,https://www.barnsley.gov.uk/media/19254/seap.pdf,Sustainble Energy Action Plan | Barnsley Council,,,E08000016,Yorkshire and The Humber,Metropolitan district,,SCR
BNS,Barnsley Metropolitan Borough Council,Whole area,2045.0,Barnsley Council set out in its climate emergency declaration in September 2019 an ambitious and realistic vision for the borough to become net Zero Carbon by 2045 (Zero45).,https://www.barnsley.gov.uk/media/19254/seap.pdf,Sustainble Energy Action Plan | Barnsley Council,,,E08000016,Yorkshire and The Humber,Metropolitan district,,SCR
BAR,Barrow-in-Furness Borough Council,Whole area,2037.0,The Borough of Barrow in Furness aims to reach net zero carbon no later than 2037.,https://www.barnsley.gov.uk/media/19254/seap.pdf,Barrow Borough Councils Climate Change Policy 2020-2025,,,E07000027,,,,
BAI,Basildon Borough Council,Council operations,2030.0,"The council recognises that all its functions and operations have an impact on the environment. The council will, therefore, reduce its impact on the local and global environment by providing clear leadership towards. achieving carbon neutrality for the organisation by 2030",http://www.basildonmeetings.info/documents/s117257/Enc.%202%20for%20CLIMATE%20CHANGE%20POLICY.pdf,"Basildon Council
Climate Change Policy",,,E07000066,East of England,Non-metropolitan district,ESS,
BAI,Basildon Borough Council,Whole area,2050.0,Councillors have approved Basildon's first ever climate change policy which aims to reduce greenhouse gas emissions and make the borough net-zero carbon by 2050.,https://www.basildon.gov.uk/article/8479/In-the-news-Councillors-approve-Basildon-s-first-ever-climate-change-policy,Climate Change Policy | Basildodn Borough Council,,,E07000066,East of England,Non-metropolitan district,ESS,
BAN,Basingstoke and Deane Borough Council,Council operations,2025.0,Setting ourselves a target to deliver services to our residents in a more environmentally-friendly way and become carbon neutral by 2025.,https://www.basingstoke.gov.uk/climateemergency,Our Climate Emergency | Basingstoke and Deane Borough Council ,,,E07000084,South East,Non-metropolitan district,HAM,
BAN,Basingstoke and Deane Borough Council,Whole area,2030.0,Work towards making Basingstoke and Deane a carbon neutral borough by 2030.,https://www.basingstoke.gov.uk/climateemergency,Our Climate Emergency | Basingstoke and Deane Borough Council,,,E07000084,South East,Non-metropolitan district,HAM,
BAE,Bassetlaw District Council,Council operations,2030.0,"Councillors at Bassetlaw District Council have unanimously committed to reducing council operations to Net Zero by 2030, following a motion to Council on Thursday 21st September 2023.","https://www.bassetlaw.gov.uk/media-centre/news/news-archive/september-2023/bassetlaw-district-council-commits-to-net-zero-operations-target-by-2030/#:~:text=target%20by%202030-,Bassetlaw%20District%20Council%20commits%20to%20Net%20Zero%20operations%20target%20by,on%20Thursday%2021st%20September%202023",Bassetlaw District Council commits to Net Zero operations target by 2030 ,,"""The UK government is at forefront of this battle, having signed into legislation June 2019 a commitment to become carbon neutral by 2050. As such, Bassetlaw District Council will be working hand-in-hand with other Local Authorities and businesses to reduce our emission and supporting the national agenda.""",E07000171,East Midlands,Non-metropolitan district,NTT,
BAS,Bath and North East Somerset Council,Council operations,2030.0,"Request that the Cabinet takes steps to identify work streams and budgets with the aim of making B&NES Council carbon neutral by 2030, across all functions, as our contribution to fighting climate change.",https://democracy.bathnes.gov.uk/documents/g5196/Public%20minutes%2014th-Mar-2019%2018.30%20Council.pdf?T=11,Climate Commitments | Bath and North East Somerset Council,,,E06000022,South West,Unitary authority,,WECA
BAS,Bath and North East Somerset Council,Whole area,2030.0,"Pledge to provide the leadership to enable Bath & North East Somerset to become carbon neutral by 2030; Sign up to the UK100 Pledge to provide the strategic community leadership needed to enable our communities to achieve 100% clean energy across all sectors in Bath & North East Somerset by 2030, as a logical step from the B&NES Environmental Sustainability Vision Motion passed unanimously by Council in July 2018, and as a way to enable carbon neutrality by 2030;",https://democracy.bathnes.gov.uk/documents/g5196/Public%20minutes%2014th-Mar-2019%2018.30%20Council.pdf?T=11,Climate Commitments | Bath and North East Somerset Council,,,E06000022,South West,Unitary authority,,WECA
BDF,Bedford Borough Council,Council operations,2030.0,"By 2030, the council’s own operations will be clean and efficient, and we will play a positive role enabling the wider borough to achieve net-zero emissions.",https://bbcdevwebfiles.blob.core.windows.net/webfiles/Environmental%20Issues/Sustainability/Strategies/Carbon%20Reduction%20Delivery%20Strategy.pdf,Carbon Reduction Delivery Strategy | Bedford Borough Council,,,E06000055,East of England,Unitary authority,,
BIR,Birmingham City Council,Council operations,2030.0,"That the Council will lead by example and seek to be net zero carbon by 2030 – again ensuring that this is just – taking communities with us, protecting employment and without impoverishing deprived communities.",https://www.climateemergency.uk/blog/birmingham/,Climate Decleration | Birmingham City Council,,,E08000025,West Midlands,Metropolitan district,,WMCA
BIR,Birmingham City Council,Whole area,2030.0,"To aspire for the City to be net zero carbon by 2030 or as soon after as a just transition permits – making sure we take communities with us, protecting employment and without impoverishing deprived communities.",https://www.climateemergency.uk/blog/birmingham/,Climate Decleration | Birmingham City Council,,,E08000025,West Midlands,Metropolitan district,,WMCA
BLA,Blaby District Council,Council operations,2030.0,"We are committed to minimising the environmental impacts of our own activities. Aiming to achieve 100% clean energy across our buildings and services and ensuring that all strategic decisions, budgets and approaches to planning decisions are in line with our ambition for the council’s own activities to be carbon neutral by 2030. ",https://www.blaby.gov.uk/media/3874/blaby-district-council-climate-change-strategy-2020-2030.pdf,Climate Change Strategy | Blaby District Council,,,E07000129,East Midlands,Non-metropolitan district,LEC,
BLA,Blaby District Council,Whole area,2050.0,"Work with partners and the community to support the district in its aspiration to be Carbon Neutral by 2050, if not earlier.",https://www.blaby.gov.uk/media/3874/blaby-district-council-climate-change-strategy-2020-2030.pdf,Climate Change Strategy | Blaby District Council,,,E07000129,East Midlands,Non-metropolitan district,LEC,
BBD,Blackburn with Darwen Borough Council,Council operations,2030.0,Blackburn with Darwen Borough Council has declared a climate emergency and set a goal to be net carbon neutral by 2030 to tackle climate change.,https://democracy.blackburn.gov.uk/documents/s9700/BwD%20Climate%20Emergency%20Action%20Plan.pdf,Climate Emergency Action Plan | Blackburn with Darwen Borough Council,,,E06000008,North West,Unitary authority,,
BBD,Blackburn with Darwen Borough Council,Whole area,2030.0,"
In acknowledgement of the urgency of the situation the Council declared a Climate Emergency and committed to work with residents and partners in the public, private and voluntary sectors to make the borough carbon neutral by 2030.",https://democracy.blackburn.gov.uk/documents/s9700/BwD%20Climate%20Emergency%20Action%20Plan.pdf,Climate Emergency Action Plan | Blackburn with Darwen Borough Council,,,E06000008,North West,Unitary authority,,
BPL,Blackpool Borough Council,Whole area,2030.0,"We need to prepare and adapt to deal with the projected impacts of climate change, and so this plan commits Blackpool to becoming carbon neutral by 2030.",https://www.blackpool.gov.uk/Residents/Planning-environment-and-community/Documents/Climate/C1682-Climate-Emergency-Action-Plan-Accessible.pdf,Blackpool's Climate Emergency Action Plan,,,E06000009,North West,Unitary authority,,
BGW,Blaenau Gwent County Borough Council,Other,2030.0,"We support Welsh Government’s ambition for the Welsh public sector to be carbon neutral by 2030, and this plan sets out how we intend to deliver on this ambition over the next ten years.",https://democracy.blaenau-gwent.gov.uk/documents/s4974/Appendix%201.pdf?LLL=0,Blaenau Gwent County Borough Council Decarbonisation Plan,,,W06000019,Wales,Welsh unitary authority,,
BOS,Bolsover District Council,No promise,,,,,,"More general - In 2018, the Council adopted the Carbon Reduction Plan which set out the Council’s ambition to both reduce its own carbon footprint, along with leading the community to do the same.",E07000033,East Midlands,Non-metropolitan district,DBY,
BOL,Bolton Metropolitan Borough Council,Whole area,2030.0,"Council therefore commits to:
Declare a ‘Climate Emergency’ that requires urgent action;
Make the Council’s activities net-zero carbon by 2030
Achieve 100% clean energy across the Council’s full range
of functions by 2030.",https://www.climateemergency.uk/blog/bolton/,Climate Commitments | Bolton Metropolitian Borough Council,,,E08000001,North West,Metropolitan district,,GMCA
BRX,Borough of Broxbourne,No promise,,,,,,Have sustainability strategy but no headline promises,E07000095,East of England,Non-metropolitan district,HRT,
BOT,Boston Borough Council,No promise,,,,,,"No date given ""Boston Borough Council declares an ongoing climate and environment emergency and commits to a pledge to reduce the Council’s carbon footprint and become netzero carbon in advance of the timetable declared by UK Parliament""",E07000136,East Midlands,Non-metropolitan district,LIN,
BPC,"Bournemouth, Christchurch and Poole Borough Council",Council operations,2030.0,"We declared a climate and ecological emergency on 16 July 2019, committing our organisation to being carbon neutral by 2030.",https://www.bcpcouncil.gov.uk/News/News-Features/Climate-and-Ecological-Emergency/Climate-and-ecological-emergency.aspx,"Climate and ecological emergency | Bournemouth, Christchurch and Poole Borough Council",,,E06000058,South West,Unitary authority,,
BPC,"Bournemouth, Christchurch and Poole Borough Council",Whole area,2050.0,"We declared a climate and ecological emergency on 16 July 2019, committing our organisation to being carbon neutral by 2030 and Bournemouth, Christchurch and Poole by 2050. 

",https://www.bcpcouncil.gov.uk/News/News-Features/Climate-and-Ecological-Emergency/Climate-and-ecological-emergency.aspx,"Climate and ecological emergency | Bournemouth, Christchurch and Poole Borough Council",,,E06000058,South West,Unitary authority,,
BRC,Bracknell Forest Council,Council operations,2050.0,Bracknell Forest Council (BFC) has committed itself to becoming carbon neutral by 2050.,https://www.bracknell-forest.gov.uk/council-and-democracy/strategies-plans-and-policies/climate-change/council-leader-statement-climate-change-january-2020,Climate Statement | Bracknell Forest Council,,,E06000036,South East,Unitary authority,,
BRD,Bradford Metropolitan District Council,Council operations,2030.0,"Commits to becoming a carbon-neutral organisation by 2030 (including Scope 1, Scope 2 and Scope 3 emissions as defined by the Greenhouse Gas Protocol).",https://bradford.moderngov.co.uk/mgAi.aspx?ID=10277,Climate Emergency Decleration | Bradford Metropolitian District Council ,,,E08000032,Yorkshire and The Humber,Metropolitan district,,WYCA
BRD,Bradford Metropolitan District Council,Whole area,2038.0,"In summer 2019, Leeds City Region (LCR) declared a climate emergency aiming for a ‘zero- carbon city region by 2038, with significant progress by 2030’. This aim was adopted by Bradford Council in October 2019.",https://www.bradford.gov.uk/media/5841/sd-action-plan.pdf,Sustainable Development Action Plan | Bradford Metropolitian Council,,,E08000032,Yorkshire and The Humber,Metropolitan district,,WYCA
BRA,Braintree District Council,Council operations,2030.0,"This Council declares a “Climate Emergency” with an aim to make Braintree District Council activities, as far as practical, carbon neutral by 2030.",https://braintree.cmis.uk.com/braintree/Document.ashx?czJKcaeAi5tUFL1DTL2UE4zNRBcoShgo=JTpLMitM57EBL86sJ32T%2fBuf1dZUfp2kDfSpfDBu%2bw9Vyxgc945jMQ%3d%3d&rUzwRPf%2bZ3zd4E7Ikn8Lyw%3d%3d=pwRE6AGJFLDNlh225F5QMaQWCtPHwdhUfCZ%2fLUQzgA2uL5jNRG4jdQ%3d%3d&mCTIbCubSFfXsDGW9IXnlg%3d%3d=hFflUdN3100%3d&kCx1AnS9%2fpWZQ40DXFvdEw%3d%3d=hFflUdN3100%3d&uJovDxwdjMPoYv%2bAJvYtyA%3d%3d=ctNJFf55vVA%3d&FgPlIEJYlotS%2bYGoBi5olA%3d%3d=NHdURQburHA%3d&d9Qjj0ag1Pd993jsyOJqFvmyB7X0CSQK=ctNJFf55vVA%3d&WGewmoAfeNR9xqBux0r1Q8Za60lavYmz=ctNJFf55vVA%3d&WGewmoAfeNQ16B2MHuCpMRKZMwaG1PaO=ctNJFf55vVA%3d,Climate Declaration | Braintree District Council,,,E07000067,East of England,Non-metropolitan district,ESS,
BRE,Breckland District Council,Whole area,2035.0,Breckland District Council declared a state of climate emergency on the 19th of September 2019 and is committed to reducing the level of Greenhouse gases emissions within the District to net zero by 2035.,https://www.breckland.gov.uk/climate-change,Breckland 2035 Sustainability Strategy,,,E07000143,East of England,Non-metropolitan district,NFK,
BRW,Brentwood Borough Council,Council operations,2040.0,Brentwood Borough Council wants to do its bit and aims to be carbon neutral within its own activity and borough-wide by 2040.,https://www.brentwood.gov.uk/sites/default/files/documents/20124/233253/Environment%2BStrategy%2B2022-2025.pdf,"Environment Strategy
2022-2025",,None,E07000068,East of England,Non-metropolitan district,ESS,
BGE,Bridgend County Borough Council,Council operations,2030.0,Bridgend County Borough Council is leading the way in its response to the challenges of climate change and achieving a position of net zero carbon as a public body by 2030.,https://www.bridgend.gov.uk/news/leading-the-way-in-net-zero-carbon-targets/,Net-Zero Carbon Targets | Bridgend County Borough Council,,,W06000013,Wales,Welsh unitary authority,,
BNH,Brighton and Hove City Council,Council operations,2030.0,We have pledged to become carbon neutral by 2030,https://www.brighton-hove.gov.uk/climate-change/becoming-carbon-neutral-2030,Climate Emergency | Brighton and Hove City Council,,,E06000043,South East,Unitary authority,,
BNH,Brighton and Hove City Council,Whole area,2030.0,We have pledged to become carbon neutral by 2030,https://www.brighton-hove.gov.uk/climate-change/becoming-carbon-neutral-2030,Climate Emergency | Brighton and Hove City Council,,,E06000043,South East,Unitary authority,,
BST,Bristol City Council,Council operations,2025.0,"We will continue to reduce emissions from the Council’s own operations and commit to being carbon neutral for direct emissions (energy and transport) by 2025 (scope 1 and 2). We will also quantify our indirect emissions (scope 3), for example by organisations providing services and goods and by tenants who occupy our residential and commercial properties. (SDG13) - page 12",https://www.bristol.gov.uk/documents/20182/33379/Mayor%27s+Climate+Emergency+Action+Plan+2019+FINAL,Climate Emergency Action Plan | Bristol City Council,,,E06000023,South West,Unitary authority,,WECA
BST,Bristol City Council,Whole area,2030.0,"Pledge to make the city of Bristol carbon neutral by 2030, taking into account both production and consumption emissions.",https://www.bristol.gov.uk/documents/20182/33379/Mayor%27s+Climate+Emergency+Action+Plan+2019+FINAL,Climate Emergency Action Plan | Bristol City Council,,,E06000023,South West,Unitary authority,,WECA
BRO,Broadland District Council,Council operations,2030.0,"Reduce carbon emissions from the council’s activities and meet our ambitious
target of net zero carbon emissions by 2030.",https://www.southnorfolkandbroadland.gov.uk/downloads/file/5959/broadland-district-council-environmental-strategy,"Broadland District Council Environmental Strategy
",20/11/23,IB found,E07000144,East of England,Non-metropolitan district,NFK,
BRO,Broadland District Council,Whole area,2050.0,"Work together to reduce carbon emissions across the district and align to the
Government’s 2050 target for wider district decarbonisation.",https://www.southnorfolkandbroadland.gov.uk/downloads/file/5959/broadland-district-council-environmental-strategy,"Broadland District Council Environmental Strategy
",20/11/23,IB found,E07000144,East of England,Non-metropolitan district,NFK,
BRM,Bromsgrove District Council,No promise,,,,,,,E07000234,West Midlands,Non-metropolitan district,WOR,
BRT,Broxtowe Borough Council,Whole area,2027.0,"In July 2019, we declared a Climate Change Emergency and committed to the ambitious reduction of the Borough’s carbon emissions to net zero by 2027.",https://www.broxtowe.gov.uk/media/8047/climate-change-and-green-futures-programme-combined-doc.pdf,Climate Change | Bromsgrove District Council,,,E07000172,East Midlands,Non-metropolitan district,NTT,
BUC,Buckinghamshire Council,Whole area,2050.0,On 15 July 2020 we committed to working “alongside national Government with the objective to achieve net carbon zero for Buckinghamshire as a whole by 2050.,https://buckinghamshire.moderngov.co.uk/documents/s17790/Appendix%202%20Climate%20Change%20and%20Air%20Quality%20Strategy.pdf,Buckinghamshire Council Climate Change and Air Quality Strategy,,,E06000060,South East,Unitary authority,,
BUC,Buckinghamshire Council,Council operations,2050.0,"The council should also evaluate reaching ‘net zero’ for its own emissions no later than 2050 and possibly before this, potentially by 2030, subject to resources.",https://buckinghamshire.moderngov.co.uk/documents/s17790/Appendix%202%20Climate%20Change%20and%20Air%20Quality%20Strategy.pdf,Buckinghamshire Council Climate Change and Air Quality Strategy,,,E06000060,South East,Unitary authority,,
BUN,Burnley Borough Council,Whole area,2030.0,"In light of the Climate Emergency, to make the Borough of Burnley carbon neutral by 2030, taking into account both production and consumption emissions (scope 1, 2 and 3).",https://burnley.moderngov.co.uk/documents/g961/Printed%20minutes%2010th-Jul-2019%2018.30%20Full%20Council.pdf?T=1,Climate Meeting Minutes | Burnley Borough Council,,,E07000117,North West,Non-metropolitan district,LAN,
BUR,Bury Metropolitan Borough Council,Council operations,2038.0,In 2019 Bury council declared a climate emergency and we have set an ambitious target to be carbon neutral by 2038.,https://www.bury.gov.uk/CHttpHandler.ashx?id=22153&p=0,Climate Action Strategy | Bury Council,,,E08000002,North West,Metropolitan district,,GMCA
CAY,Caerphilly County Borough Council,Council operations,2030.0,"On the 4th June 2019 the Council formally declared a climate emergency as a Notice of Motion, with full support from all political parties. As a result of this, Caerphilly County Borough Council has committed to being net carbon neutral by 2030.",https://www.caerphilly.gov.uk/CaerphillyDocs/Council-and-democracy/DecarbonisationStrategy/DecarbonStrategy2020_eng.aspx,Decarbonisation Strategy | Caerphilly County Borough Council,,,W06000018,Wales,Welsh unitary authority,,
